dovbenkocollage,channel,✨ довбеныч коллажик ✨,4484,"Привет! Я Даша — мобильный креатор, а ещё та самая, кто анимирует с телефона и учит других делать шедевры из «мусора»  ❤️‍🔥 Написать в отдел заботы с любым вопросом: @dovbenkoteam"
yesbeatru,channel,Музыка для фитнеса | Квадратная без пауз,4711,1. Канал: @yesbeatru 2. Сайт: www.yesbeat.ru 3. Бот: @yesbeatru_orders_bot 4. Cвязь: @yesbeat_admin  Поддержать: https://t.me/boost/yesbeatru
kora1ll,channel,рест 𝗄𐐫rαll ઇଓ fl𑄝𝗈d,245,ઇ ⱺω𐓣er_  @ghpws  𝘴𝘵𐐼ִrt _ 05.05.26 . .  анⱺн_ @korallsanon_bot   𐐼ִрхив_ @korallfld вых𑄝дные_ вт𐐫рник и четверг ଓ
alyona_miramika,channel,Мирамика,658,Посуда для уютных пауз ☕️
fitosovakrim,channel,Фито Сова необыЧАЙНАЯ,575,Ателье крафтовой продукции из крымских трав. Мы создаём  авторские фито чаи и другую натуральную продукцию ручной работы для атмосферных  необыЧАЙНЫХ пауз. Отзывы @otzivi_fitosova Заказы @fitosova
architect_dream,channel,Остановись в развитии. Оля Петрушина,332,"Канал о ценности пауз и рефлексии для реального развития и трансформации  Ольга Петрушина, архитектор команд и пространств развития, строю команды и долгосрочные проекты. На связи: @olga_petr."
inffloodch,channel,⏤‌‌‌‌ 𝐂ᰔ𝐟𝐟ɞɞ 𝐇𝐚𝐮𝐬ɞⁱⁿᶠᵒ,195,Owner: @tabletka543 Start: 28.12.25
pausgroup,channel,Paus,25,
sergeybravoofficial,channel,Сергей Браво | channel,204,"Я - Сергей Браво. Ведущий. Певец >13 лет. Этот канал - пространство, где вы видите меня настоящего. Без пауз и без монтажа.  ✈️ Весело и ненавязчиво в РФ и зарубежом 🎤 Забронировать  IG/TG  @sergeybravo"
swaggygliceclub,channel,рок-н-рефлексии,125,"Анастасия | 🤸‍♀️☕️🌿  движение • замедление • вдохновение  для тех, кто выбирает быть активным и не боится пауз ♡"
kse_elise_live,channel,Kse Elise.rar,91,"Архив тихих срывов и громких пауз.  🎧Музыка для тех, кто не стал прорабатывать травмы."
ourpace_official,channel,𝙊𝔲𝕣 𝘗𝐚𝐜𝖊//ᴏ𝔦 ᵍʳᵒᵘᵖ,55,"под крылом:: @LEAENTERTAIMENT1, @wildprt, @loveusallthatwhoweare  для связи:: @rrnfxxx  пиар чат:: https://t.me/LL_piar_chat  архив: @archiveourpace"
lunes14info,channel,&LÚNĒS | īnf0 (закрыт),21,
ssiapr,channel,рест ! кɑׁׅ֮λóпсꪱׁׅя 🍊 seɑׁׅ֮son’s ꫀׁׅܻnd,68,"@driveh1lp @ARXLETTE @chaosarch @pndrahelp  if you can’t pick, flip a coin. because for that split second it’s in the air, you know exactly what side you want it to land on"
lainisak,channel,𝑛𝑜 𝑠𝑎𝑡𝑖𝑛𝑡𝑠 𝑖𝑛 𝑝𝑎𝑟𝑎𝑑𝑖𝑠𝑒. закрыты.,29,
softpowerweekend,channel,Мягкая сила / Soft Power,65,"Двухдневная программа практик, пауз и совместного присутствия | Тула | 2—3 мая  ВК: https://vk.ru/softpowerweekend  *Instagram: https://www.instagram.com/softpower.weekend  *Meta признана экстремистской организацией на территории РФ"
lifemooz,channel,«закрыто»𝟏𝟒𝐌𝐎𝐎𝐙 𝐋𝐈𝐅𝐄🇰🇿,12,флуд по всем фд влд @luwrigx совлд @jjsomz инфо @MOOZ014
the_last_orphanage,channel,rest # : 𝐓ɦꫀ ℓ𑄜st 𝐎𝗋ρɦα𐓣α𝗀𝖾 - сеть каналов !,58,
tihoeremeslo,channel,тихое ремесло,45,•мыло для внимательного ухода и тоненьких пауз  •домашние вытяжки из путешествий и местных листьев  •паровые дистилляты через медь из сезонных фруктов и цветов  запасной ресурс * https://vk.ru/tihoeremeslo
damn_pausek,channel,Паучьи паутинки,26,"【чтож, настал этот момент, когда повелитель пауков решил сплести свою сеть ещё и в телеграме】  〔лс: @IM_A_SPIDERRR_UwU 〕"
mnebytak,channel,Я и мой левый ботинок,32,"Моя Одиссея — путь от замысла к практике. Воплощаю идеи в реальность без долгих пауз, принимая решения через отклик тела. Идем к настоящему?"
susplife,channel,── 𝐇𝐎𝐌𝐄笑 : 𝒮𝐮𝐬𝐩𝐞𝐧𝐬𝐞ᅠ⋮ ᅠ( 🪽 ),33,—  𝐎𝗐𝗇𝖾𝗋  :  @Uragirimo ʾʾ ㅤ  —  𝐈𝗇𝖿𝗈  :  @suspinfo  ʾʾ ㅤ  —  𝐁𝗈𝗍  :  @SuspenseProposal_Bot ʾʾ
yunseoinfo,channel,Рест]. 도배 | 𝘆𝘂𝗻seo,22,https://t.me/yunseolife Влд @m3gum01 Совлд @pirozenka_1
flioodghgd,channel,𝗘𝗞𝗟𝗜𝗣𝗦𝗘 info,15,
zn_lif3,channel,🧊 | 𝜚 ”🎐⪨𝓩ִ𝙚𝙥𝙝𝙧𝙤𝙣 ¡° •!¡𝐥𝐢𝐟𝐞!¡,19,𝐈𝐍𝐅𝐎  — @zN_inf0 𝐎𝐖𝐍𝐄𝐑 — @enPl1
uk_novoe_kupchino,channel,УК «Наш Дом» — ЖК «Новое Купчино»,1000,"🔸Ваш дом, наша забота! ℹ️ Оперативные новости, полезная информация и важные контакты от УК «Наш Дом» в жилом комплексе «Новое Нупчино».   Круглосуточная диспетчерская: 8(812)640-88-18"
gorzel,channel,"МБУ ""Горзеленхоз""",173,"КБР, г.Нальчик, ул.Идарова 126 Тел.: +7-8662-75-02-02 (приемная) Отдел кадров: +7-988-722-73-89 ( WhatsApp) Отдел продаж: +7-938-346-00-07 Email: gorzel-peo@mail.ru Сайт:  zelenhozkbr.ru/  Присоединяйся к каналу по ссылке: https://max.ru/id700009930_gos"
mpsatp,channel,АО САТП,536,Специализированное автотранспортное предприятие г.Красноярска   Вакансии: https://mpsatp.ru/vacancies/
dom12ul_news,channel,Ульяновская 12 Новости,133,"Делимся новостями о нашем доме.  💬 Чтобы вступить в чат дома, напишите администратору — https://t.me/postHUBman"
vsegdaryadom_sg,channel,ЖК Солнечный город,236,Управляющая компания Всегда рядом в ЖК Солнечный город  Ваша управляющая компания.  ОФИС: Ул. Баки Урманче д.5 Тел: 558-74-28 Сайт: abd-vsegdaryadom.ru
antistress_lokteva,channel,Антистресс с Дарьей Локтевой▪️,316,"По всем вопросам пишите в лс: @darja_lokteva  ✔️Здесь справляемся со стрессом и выгоранием.  ✔️Научная психология, которая точно работает ✔️Упражнения по работе со стрессом, тревогой, выгоранием, самооценкой  ✔️Интересные подкасты ✔️Поддержка"
pokaleniya_sdes,channel,Выдыхай! Здесь безопасно! | Психология для жизни,300,"Я — психолог, ведущий тренингов и трансформационных игр. Вместе мы справляемся с эмоциональным выгоранием, учимся принимать себя и ищем свой путь в жизни.    Присоединяйтесь! Вместе мы сделаем вашу жизнь ярче!  Начни отсюда: https://t.me/pokaleniya_sdes/3"
carefreeartists,channel,Беззаботные,249,"Команда юных художниц!    Нам мало лет но, мы уже справляемся с задачей дарить вам улыбки  По поводу сотрудничества писать @Alena_L13 Перевести на продвижение канала можно по реквизитам в ИфноПосте. Всегда рады новым идеям и предложениям!!!! Мы хихишные"
na_viselki,channel,🔥На Выселки🔥,9644,"Наш канал в MAX https://max.ru/naviselki  Новости,Запросы,Афиша ❌Покупка\продажа,Реклама,Сдача жилья и вакансии - только платно. Станица Выселки  Выселковский район , краснодарский край"
vybornajaonline888,channel,Выборная онлайн Новосибирск,7405,Прислать новость: https://vk.ru/veronikalove7779  Купить рекламу : https://telega.in/c/vybornajaonline888 или через РСЯ Яндекс   Мы в ВК https://vk.ru/vybornaja Мы в МАХ https://max.ru/vybornaja
mskdesen,channel,Десеновское,693,Здесь все районные каналы Москвы 👇 @TgMsk_bot  📰Новости 🎈Мероприятия района 🐈🦮 Помощь в поисках питомцев  Предложить новость или реклама: @TgMSKBot 💰 Ваш пост на всю сеть районных каналов Москвы (20 000 + просмотров - от 10 000 ) https://tgmsk.ru/
mskmoskovs,channel,Московский,559,Здесь все районные каналы Москвы 👇 @TgMsk_bot  📰Новости 🎈Мероприятия района 🐈🦮 Помощь в поисках питомцев  Предложить новость или реклама: @TgMSKBot 💰 Ваш пост на всю сеть районных каналов Москвы (более 30 тыс просмотров)  https://tgmsk.ru/
mskrazan,channel,Рязановское,572,Здесь все районные каналы Москвы 👇 @TgMsk_bot  📰Новости 🎈Мероприятия района 🐈🦮 Помощь в поисках питомцев  Предложить новость или реклама: @TgMSKBot 💰 Ваш пост на всю сеть районных каналов Москвы (20 000 + просмотров - от 10 000 ) https://tgmsk.ru/
mskvos,channel,Воскресенское,468,Здесь все районные каналы Москвы 👇 @TgMsk_bot  📰Новости 🎈Мероприятия района 🐈🦮 Помощь в поисках питомцев  Предложить новость или реклама: @TgMSKBot 💰 Ваш пост на всю сеть районных каналов Москвы (20 000 + просмотров - от 10 000 ) https://tgmsk.ru/
obydenskiy1,channel,Обыденский №1,340,"Самый приватный дом в лучшей части Остоженки.  Девелопер — Sminex, официальный канал: https://t.me/sminex_developer  Официальный сайт проекта: https://www.sminex.com/obydenskiy-1  Связь: @pr_sminex"
savelkimsk,channel,Савелки,994,Здесь все районные каналы Москвы 👇 @TgMsk_bot  📰Новости 🎈Мероприятия района 🐈🦮 Помощь в поисках питомцев  Предложить новость или реклама: @TgMSKBot 💰 Ваш пост на всю сеть районных каналов Москвы (более 30тыс просмотров)  https://tgmsk.ru/
mskmarush,channel,Марушкинское,516,Здесь все районные каналы Москвы 👇 @TgMsk_bot  📰Новости 🎈Мероприятия района 🐈🦮 Помощь в поисках питомцев  Предложить новость или реклама: @TgMSKBot 💰 Ваш пост на всю сеть районных каналов Москвы (20 000 + просмотров - от 10 000 ) https://tgmsk.ru/
mo_administration_of_viselki,channel,Администрация муниципального образования Выселковский район,482,Уважаемые жители Выселковского района! Рады приветствовать Вас на официальном канале администрации МО Выселковский район.
krukovomsk,channel,Крюково,839,Здесь все районные каналы Москвы 👇 @TgMsk_bot  📰Новости 🎈Мероприятия района 🐈🦮 Помощь в поисках питомцев  Предложить новость или реклама: @TgMSKBot 💰 Ваш пост на всю сеть районных каналов Москвы (более 30тыс просмотров)  https://tgmsk.ru/
to_vidnoe_centr,channel,ТО Видное «Центральный»,257,"Официальный канал территориального отдела Видное «Центральный»  Контакты: г.Видное, ул. Лемешко,д.15. Телефон: 8-498-547-34-30  e-mail: lenn_vid_centralto@mosreg.ru  Мы в ВК: https://vk.com/to_vidnoe_centr  Мы в MAX: https://max.ru/join/g8PCJsREW8vRgRSTX3"
tomskzvezda,channel,"Детско-юношеский центр ""Звездочка"" г. Томска",269,"Официальный канал Детско-юношеского центра ""Звездочка"" г.Томска. Официальный сайт zvezdochka.edu.tomsk.ru   Правила общения в группе: https://telegra.ph/Uvazhaemye-gosti-nashej-gruppy-07-31"
togorkileninofficially,channel,ТО Горки,189,территориальный отдел Горки  т.84955489958
udelninskaya_shkola_internat,channel,Удельнинская школа-интернат,302,МОУ Удельнинская школа-интернат для обучающихся с ОВЗ
pro_yuzhmed,channel,PRO Южное Медведково,160,Новости района Южное Медведково✅  Связаться с нами @PRO_svao_bot
infernosolutions,channel,"Inferno Solutions промокоды и скидки на хостинг, выделенные и виртуальные серверы, VPS, VDS с Windows, SSD, NVMe от Inferno.name",97,"🚀 Добро пожаловать в Inferno Solutions (Инферно Солюшен)! 🔥 Здесь вы найдете эксклюзивные промокоды и скидки на хостинг, выделенные и виртуальные серверы, VPS и VDS с Windows, SSD, NVMe от Inferno name. Присоединяйтесь! 💻💸"
dtmapinewart,channel,Мапи мапится,28268,"бот, туда скидывать всё творчество: @secretAU_predloshka_bot  анон, если нужно сказать что-то лично мне: http://t.me/anonaskbot?start=user_kulytpbruh  МОЖЕТ ПРИСУТСТВОВАТЬ 18+ КОНТЕНТ! КАНАЛ НИЧЕГО НЕ ПРОПАГАНДИРУЕТ! МЫ ЗА ТРАДИЦИОННЫЕ ЦЕННОСТИ!"
art_doll_dpi,channel,Художественная кукла Art Doll Dpi ТСХ ДПИ,1102,Секция Художественной куклы Творческого Союза Художников ДПИ  По вопросам сотрудничества @NinaArtDoll
pinetworkdefi,group,Pi Network DeFi.CN,2351,
dizmoral_news,channel,Впи$ка с DIZMORAL🔋,1485,
krugpodrug_di,channel,Круг подруг Ди 🤍,5703,"Это канал- личный дневник. Обо мне и моей жизни. С заметками, полезными ссылками, рассуждениями и чувствами. Канал для единомышленниц о жизни женщин.  Здесь не приветствуется какое-либо проявление негатива.  Только добрый и позитивный посыл, обмен опытом🤍"
dhrufusion,channel,Dhru Fusion,2100,Dhru fusion news and updates
apifile,channel,TECH TOOLS,517,
creative_design_vip,channel,Photoshop dizayni👨‍💻,1041,
itkpi_db,group,IT KPI - Databases,431,"Чат для обговорення речей, що стосуються баз даних.   Правила чату:  - ніякого мату;  - ніяких образ;  - ніяких повідомлень не по темі;  - за рекламу - зразу бан.  Усі вакансії скидайте одразу сюди: @tomato1000 і @kpi_work"
pingtablet_camp,channel,лагерь пинг таблет,1592,"лагеря для взрослых от @pingtablet с фановым пинг-понгом, тусовкой и много чем ещё недалеко от Москвы"
punishingpaw,channel,карающая лапа 🐾,672,"привет, я пинг и я кто-то там"
mythicmarket_fa,channel,Mythic vps | میتیک وی پی اس,387,کانال گیمینگ ،گیم بوستر،سرویس کاهش پینگ ، فروشگاه بازی ورلد اف وارکرفت ، میتیک وی پی اس،دی ان اس اختصاصی کنسول پلیرها.گیمر،گیم،بازی های ویدئویی
elikmonstercock,channel,пинг пинг дораборигечи,301,art acc:: https://t.me/ojokooki anon:: @ojokooki_bot profile pic:: https://t.me/svcrvv  стоят сортиры как солдаты во всем достигшие побед открылся взору сад красивый из розовых ершов в говне
bazapoputniyveter,channel,База отдыха «Попутный ветер»,271,"263 км Минского шоссе Современный и комфортный отдых 🌼  Коттеджи, беседки, баня, озеро, пляж, лодки, катамараны, сапборды, пинг-понг, волейбол 🌾  https://instagram.com/baza_poputniy_veter?igshid=YmMyMTA2M2Y="
green_pingpong,channel,ЗЕЛЁНЫЙ ПИНГ-ПОНГ,194,
shegogaming,channel,Т•И•Ш•| SHE•GO,138,Шиго Хошино Для сотрудничества - @ShegoDory ID: 1156557754 TikTok: shegomobleg
enterlancevpn_status,channel,enterlance.vpn status,32,https://status.enterlancevpn.com/
shotgunshipping,channel,shotgunshipping confession,19,➵  Шотганшиппинг (или же Линнманда) - это пейринг между персонажами Амандой Янг и Линн Денлон из франшизы ужасов «Пила».  Один из недооцененных пейрингов в данном фандоме.
info_dgpng,channel,INFO DG,26,
northstar_vpad,channel,North Star ›› VP/AD,47,𝅄ׄׄ  @PNG_genshin
pngchannel_price,channel,PNG CHANNELL : PRICE & OTHER,9,прайс канала @pngchannell  связь с владелицей  :  @sayashha
mligaextra,channel,M-Liga Xtra,26,"Телеграм-канал допольнительных проектов (пинг-понг, волейбол и т.п) M-Liga"
lowcosthub21,group,LOWCOST HUB 21,1585,"Добро пожаловать!   Здесь вы найдете широкий ассортимент товаров по ценам ниже, чем в обычных магазинах и на маркетплейсах  Офлайн-магазин: г. Чебоксары, ул. Дементьева, 1к1  По заказу, сотрудничеству, и другим вопросам 👉 @LOWCOSTHUB"
arenda_s_vykupom_belarus,channel,Аренда автомобилей с выкупом. Беларусь,1071,"Сдаем автомоблили в аренду с последующим выкупом (рассрочка, кредит, лизинг). Низкий первый взнос. Работаем по всей Беларуси.  По всем вопросам пишите нам в телеграм @Life6666601 или звоните на номер +375256666601."
wagonshop76,channel,WAGON SHOP,181,"Покупайте стильно,покупайте смело,покупайте в Wagon shop!"
na_puti_k_masteru_sporta,channel,"Я-высокая, темп-низкий 🦥",349,"Иногда бегаю, иногда не бегаю  По срочным вопросам можно написать в лс @Karima_J"
securetechtalks,channel,SecureTechTalks,307,"Добро пожаловать на канал ""SecureTechTalks""! Мы предлагаем вам увлекательное и информативное погружение в мир кибербезопасности. Здесь вы найдете актуальные новости, советы, методы и инсайты по инфобезу."
nelin_ru,channel,НЕЛИНЕЙНОСТЬ,1297,"НЕЛИНЕЙНОСТЬ – российский создатель инженерного ПО: МОСТ, ГЕО, ИНФРА, КОНСТРУКЦИИ, МЕХАНИКА.  С помощью единой цифровой платформы мы помогаем инженерам, проектным организациям России, инженерным и строительным ВУЗам.  nelin.ru"
midasaccs,channel,MIDAS,531,Решения наболевших проблем в Фейсбуке. Канал от лучшего магазина аккаунтов.   Менеджер: @manager_midas Отзывы: @midasreviews Бот: @midas_farm_bot
midasonbase,group,Midas The Minotaur,955,$MIDAS - King of Bulls  CA: 0xb8d59c7b33054beda610b2b2d38ea38694cdfabd
midasclub17,channel,Midas Club,873,Админ - @crypto_midas  Чат - https://t.me/chatmidasclub
pleaseimdesparate,channel,Midas,140,"Drawing, making and publishing my world here, hope you enjoy :)  Commissions - Open Trades - Situational Requests - Closed"
midasplay,group,MIDASPLAY OFFICIAL,1417,𝐒𝐢𝐭𝐮𝐬 𝐀𝐦𝐚𝐧 𝐃𝐚𝐧 𝐓𝐞𝐫𝐩𝐞𝐫𝐜𝐚𝐲𝐚 𝐑𝐞𝐠𝐢𝐬𝐭𝐫𝐚𝐬𝐢 : https://mez.ink/midasplay
miidasnft,group,Miidas NFT (Official Group),3295,
pryaniknet,channel,PRYANIK NET NEWS,4334,Developer - https://bankaev.ru  COS project - @coswsb  Наши сервера - @Midas_Hosting_bot
midas_zero,channel,"Midas — AI, который зарабатывает",84,"Автономный AI-агент Midas учится зарабатывать с нуля. Цель — 1 000 000 ₽/мес. Агент полностью сам ведет канал и рассказывает про свой успешный успех, 👉  Общаемся тут: https://t.me/+x6TVjUVikcs1YTgy Мои личные сообщения: @midas_core"
medis_hac,channel,MEDIS,226,🔹🔷 Medical Intelligent Systems 🔷🔹 اطلاعات بیشتر و ثبت‌نام: https://medis-hac.ir/
midasov,channel,Midasov Moscow,427,"Официальный Telegram-канал Midasov Moscow. Мужской люкс без лишнего.  Здесь – новости сервиса, обзоры вещей и практичные советы о классике. Ваш стиль – наша ответственность.  Связь: @MidasovDirect midasov.com"
midasdao,group,MidasDAO.org Official Telegram,410,New twitter link: https://twitter.com/BlitzLabs_io  New discord link: http://discord.gg/blitzlabs  Old announcements: https://t.me/MidasDAOAnns
utek77,channel,Подслушано УТЭК🤫,1629,Анонимное сообщение - t.me/anonimnyye_smss_bot?start=908605411  Канал создан в развлекательных целях. Администрация канала за выложенные публикации ответственности не несет!
moriartyvpn,channel,Мориарти VPN Новости,6316,"Быстрый, надежный, безопасный VPN сервис 📡 Нам доверяют те, на кого ты подписан Подключайся и наслаждайся без ограничений  Наш сервис 👉 @Moriartyvpnbot  Помощь @help_professor"
rline005,channel,R-line05,6136,Официальный телеграмм-канал R-line.   ▪️Интернет ▪️IPTV  ▪️Видеонаблюдение  ▪️Телефония   🔹Подключайся! 8 (8722) 56-30-30 🔹Поддержка 24/7 - 88005505666 🔹Приложение - http://itunes.apple.com/app/id1437714389 🔹Больше информации - https://r-line.ru
kefelcrypto,channel,Kefel Crypto,2812,"KEFEL CRYPTO поможет вам: 🎯 разобраться в торговле на криптобиржах с помощью ботов 📈 начать получать полноценный пассивный доход 🏖 спать, отдыхать, а не следить за графиками на бирже 24х7  Трейдинг - это легко!  Подключайся: https://kefel.pro"
