marinastoboi,channel,Марина Курьянович | клинический психолог,231,"Канал о психотерапии гештальт-терапевта и наставника для психологов  О любви к жизни, надежных отношениях и принятии себя.  Помогаю вам жить в согласии с собой, своим партнером и своим делом.  Для связи: @marina_stoboi VK: https://vk.com/rasskazhi_marine"
nikitadenisenko_blog,channel,Никита Денисенко | Психолог-эксперт,205,"Психолог, выпускник школы мышления А. В. Курпатова.  Работаю с тревогой, выгоранием и ощущением «я больше так не могу» - без воды и эзотерики, 100+ реальных кейсов.  Научный подход, результативный краткосрочный метод  Давай знакомиться - начни с закрепа"
pologotina_pro,channel,Пологотина Ольга | PRO уверенность и качество жизни,196,"Психолог | Бизнес Тренер | КПТ Терапевт   Тут ты поймёшь, что с тобой происходит Помогаю собрать себя заново после выгорания, кризиса и тяжелых отношений  Краткосрочная терапия через научный подход   Запись на консультацию только 👉🏻@pologotina_olga"
aleksandrak_psihologiya_pro_gizn,channel,К Жизни через Психологию с Александрой Кузнецовой,109,"❗️Как найти время на себя, когда нет сил, но есть муж, дети и работа?  ✅ Самые мощные инструменты.  ✅ Делюсь секретами счастливых отношений. ✅ Помогаю найти себя в себе.   ✍️ Связь со мной  -  @Alexandera2"
shibkova2909,channel,Шибкова в гештальте🌹,76,Психологическая гостиная Елены Шибковой.     Мой сайт: https://elenashibkova.ru/
vladimirr_tvp,channel,Владимир Р - Психология ТВП,31,Психология ТВП   - Выявление самых сильных травмирующих событий и отключение их вредного воздействия. - Выявление и отключение блокирующих убеждений. - Наполнение ресурсным состоянием. - Фокусировка внимания на желаемом.
otnoseniya,channel,PRO отношения,82,"Канал про отношения, психотерапию и личностный рост"
psihologames,channel,Оксана Михалева. Психолог. Психотерапевт.,44,"Канал для тех, кто хочет счастливых отношений с собой, партнером, детьми и др,  но не понимает почему ничего не получается и как наладить отношения, как выйти из абьюзивных отношений, пережить потерю, развод и т.д.   Запись на консультацию @OksanaMihaleva"
riotuchebniicentr,channel,Учебный центр РИОТ. Охрана Труда и СОУТ,63,"Только нужное для специалиста по охране труда: обзоры новых НПА, скидки на обучение, приглашения на семинары по охране труда"
kkong79,group,굿초이스 무료쿠폰및입플주는사이트공유(먹튀보장),77,이방위 취지는 제가 제휴 맺은 사이트나 보증업체들을 소개해드리고 입플 및 게릴라 이벤트 등 꽁머니 다양하게 서비스받으실수있도록 서로 정보 공유하고 제휴 하는 방입니다  이벤트트 매일 하고 있으면 참여도를 높이기 위해서 이벤트 내용도 재미있을겁니다 또한  상품이나 상금도 높습니다 ^^ 많은 정보 공유하고 다양한이벤트 챙겨가세요
dolbikong,channel,돌비콩의 투자정복,9277,함께 크립토 공부를 해보아요. 올라오는 정보는 투자적 조언이 아닙니다.  문의 @bitxrpmax  채팅방 https://t.me/dolbikong2 트위터 https://twitter.com/DBKventures 블로그 https://blog.naver.com/dolbikong
web3learningwithinger,channel,돈포하 I Dont focus on hype,4042,채팅방 : https://t.me/Dontfocushypechat  투자 권유 채널이 아닙니다. DYOR. NFA.  Love Alpha.   DM : @Decentralintern.
rere2win,channel,"레레이의 일본,에드작 이야기방",3520,https://t.me/otakurere 채팅방 가끔 쓸만한 정보도 물어오긴합니다 dm: @rhythmrere X: https://x.com/Rhythm_rere2   이채널의 유메모노 추천은 귀여우니까 매수권유입니다  유메모노외에 다른정보는 매매에 대한 조언이 아닙니다.
nuclear_man_telegrem,channel,에너지맨,834,에너지과 관련된 정보 및 생각들을 다룹니다 매수 매도 추천 아닙니다
otakurypto,channel,사카밤바스피스 낙서장,531,"@ratskra 의 낙서장입니다  현 BLUENODE 학회장  투자 권유가 아닙니다 DYOR, NFA"
migukstocksailor,channel,뉴욕 찍먹 투자,376,/ 미장 / 국장 / 매크로 /  찍먹 매수 매도 추천 아닙니다
questionsforquiz,channel,Квиз - вопросы,300,
ggeminiprompt,channel,GGP (Google Gemini Prompt),195,
adhkar_a,channel,ذِڪـر | Dhikr,207,لا إلهَ إلاّ الله وحدهُ لا شريك له لهُ المُلك ولهُ الحمد وهو على كل شيءٍ قدير .  Insta: https://instagram.com/adhkar.a10
zill707xxxxxxxi,channel,ظِلّ.,276,كأنَّكِ ظِلُّ الروحِ أينما أمَّمتُ.
sal_m_h,channel,سـلسبيـلا ♡,223,وآنِسْنِي بكَ أُنساً يُعوِّضُني عن وَحْشةِ النَّاس.  طويلبة طبٍّ بشـري 🩺💊
justcorejust,channel,𝐌𝐲 𝐂𝐨𝐫𝐞 :,98,أُفتِّشُ في الزِّحامِ عن المَفَرِّ    وعُمْري كالسَّحابِ مَضى يَسيرُ !
ourpalastine,channel,أقصانا | لا هيكلهم,42,لأنَّ المسجد الأقصى ليس روايةً عابرة، بل هو عقيدةٌ وتاريخٌ وهوية.
xinume,channel,桜̟࣪夜♱𝆬- 𝟷๋𝟽۪̟𝟸 ‌࣪,647,݁₊ ‌  ⊹ ‌  ݁在黑࣭̟720暗中࣪感̟࣪ 🩹觉ْ๋۪轻盈 ‌ س̟پ‍‌يد๋بأ̟ل   ‌ ‌ ‌ ‌ ‌ ‌ ‌ ‌ ‌ ‌أ̟ش‍‌࣭࣪ك ه‍‌أ࣭̟࣪ي قد๋࣭̟࣪ی‍‌سأن̟ @grimesgirlybot 🦴 أب‍‌دی̟۪࣪ت๋۪࣭࣪   ‌‌ ‌‌  ‌‌没࣪人۪࣪注̟۪视࣪8时๋۪࣭۪࣪我更࣭̟自๋̟۪࣪在 000(  ˊ‌˂˃ˋ‌  )
thingsiliked,channel,"речі, які нічо так",96,"час від часу я буду ділитись тут якимось контентом, типу фільтрувати поток мемів і залишати обране  https://linktr.ee/nichotak"
liniligg,channel,Linili,104,TikTok: @niksami555 🖤
njkitin,channel,𝓃𝒾𝓀𝒾𝓉𝒾𝓃,183,
cass14n4,channel,cassiana creep,56,сотрудничество:
weightofthings,channel,примерный вес вещей,22,
gribuha,channel,.rvetka,151,я рисую
arabka_virt,channel,𝑪умасшедшая 🌷/РЕСТ,78,여름 하늘 아래 모든 것이 빛난다-Под летним небом всё сияет🌊☀🌸
dilixx_xxx,channel,@ ` диля »,80,
tenoranooo,channel,𝐓𝐄𝐍𝐎𝐑𝐀𝐍𝐎,78,
serotoningifs,channel,гифки с серотонином,34,"ничего не моё, всё покрадено"
toplacate,channel,🛖,25,
hard_gi,channel,Hope you’re feeling,24,
lilitililit,channel,шутки кончились,22,
aconspiracytheorist,channel,THE WORLD AHEAD 2026,33,"1. 정치적인 언어는 대체로 진실을 거짓처럼 들리게 하고, 살인을 존경할 만하게 만들며, 순수한 바람에 불과한 것을 견고함의 모습으로 만들어내기 위해 고안되었다.  2. 과거를 지배하는 자가 미래를 지배한다. 현재를 지배하는 자가 과거를 지배한다.   3. 자유가 무엇인가를 의미한다면, 그것은 사람들이 듣고 싶어 하지 않는 것을 말할 수 있는 권리를 의미한다.   4. 기만이 보편적인 시기에는, 진실을 말하는 것이 혁명적인 행동이다."
jusikbiso,channel,주식비서 시황/주도주/뉴스,3012,"시대의 주도주에 집중하면 시장을 이긴다.  ✔️ 시황 분석 ✔️ 핵심 주도주, 대장주 집중 ✔️ 중요 뉴스 선별  주식비서(엠아이컴퍼니)는 유사투자자문 교육과정을 수료했으며, 금감원의 가이드라인을 준수하는 건전한 투자 파트너입니다.  본 채널의 내용은 매수매도 추천을 의미하지 않으며 국가대표, 명장, 송팀장 3인이 운영합니다.  ★ 문의 t.me/bisoadmin ★ 유튜브 www.youtube.com/@jusikbiso"
heunnnnnn,channel,흔자,874,"리서치와 개발 그리고 가끔 헛소리하는 방   채팅방: https://t.me/heunchat 관리자: @heunja  * 본 채널의 의견은 개인 의견이며, 회사의 공식 입장이 아님을 밝힙니다."
infrarot_medien,channel,InfraRot - Neu,8587,
inimicizie,channel,Inimicizie,3555,"Blog di geopolitica del mondo multipolare, strategia e storia  Indice: t.me/inimicizie/249"
infocus_live,channel,InFocus,1329,Будьте в фокусе самых важных общественно-политических  и культурных событий. Наш сайт: https://InFocus.press   Для связи пишите @baranovskiy_ns
inmediate_ann,channel,Inmediate Announcement Channel,140,"The platform that connects Consumers, Insurers, and Distributors using Distributed Ledger Technology, Artificial Intelligence and IoT"
inmediina,channel,in medina,529,
lasnoticiasdelmundo,channel,Las Noticias 🗞,978,
interfax_news,channel,ИНТЕРФАКС,866,Новостная лента информационного агентства Интерфакс interfax.ru
infored24,channel,InfoRed24,384,📰 Noticias al instante 📡 Información en tiempo real 🌍 Venezuela y el mundo 👇 Síguenos 🌐 www.infored24.com
riviera24,channel,Riviera24.it,209,Il quotidiano online della provincia di Imperia
chatkeeperbot_en,group,ChatKeeperBot Support,5622,Multilingual support chat about @ChatKeeperBot. Bot for Moderation and Analytic of Telegram groups.  📌You can write in English. 📌Vous pouvez écrire en Français. 📌Usted puede escribir en Español.  Our news channel — @ChatKeeperBotEN
urquiadice,channel,Urquía Dice,183,
meteoalertacmg,channel,El Tiempo en Camagüey,582,"Canal Oficial del Centro Meteorológico Provincial de  Camagüey, donde usted podrá obtener información actualizada de lo que ocurre en nuestra provincia."
fscccoomadrid,channel,Noticias FSC CCOO Madrid,173,Canal público de la federación de servicios a la ciudadanía de CCOO de Madrid
bandocomunidad,group,Bando | Official Community,510,Bando enables a new spending use-case in web3. Enabling usted to buy (almost) anything directly from your favorite wallet.
uste_ruca,channel,[Архив] Истерика,34,Добро пожаловать 💫 Здесь публикуются дополнительные посты по моим вселенным  Щитпост – https://t.me/+46PC-APjYmUxNzZi
bravovolleysportt,channel,Браво | Волейбольная школа🏐,502,"Мы - спортивная школа по волейболу! Главное наше отличие - современный подход, следи как мы растём!"
invasorpress,channel,Periódico Invasor,1667,"Somos la plataforma multimedial de noticias de la provincia Ciego de ávila.  Queremos contar historias que importan, también aquí en Telegram.  Únete, comparte y no te pierdas ni una de nuestras entradas.  http://www.invasor.cu"
querenciiam,channel,شرقیِ‌غمگین.,440,- راه داده بودم به ماه. https://telegram.me/INashenasbashbot?start=sc-tiBHokp56R
losignorantestv,channel,iGNRNTS,912,Queremos salir de la ignorancia un tema a la vez.
maimesvlc,channel,📣 Mai Més València,653,Canal difusió Mai Més València
monasteriosantacruzbenedictinas,group,Benedictinas Sahagún,842,Aquí recibirás noticias y propuestas de la comunidad de las Benedictinas de Sahagún.  ¡Te queremos en el grupo!
ianina_avtor,channel,Я хочу стать Вампиром,262,"«Я хочу стать Вампиром» - новый роман Янины Первозванной, автора книг «Быть ведьмой», «Локи: Сказки железного леса» и др. (вышли в издательстве @vesbook)   Канал выходного дня от кандидата наук 👩🏼‍🎓 @ianina_law_school"
ya_v_dele_vladivostok,channel,Я в деле | Приморский край,398,"Хочешь стать участником - регистрируйся по ссылке: https://forms.yandex.ru/u/68d0cbc7d0468894df356784  Мы - ЯВДельцы, мы про людей, команды, предпринимательство и движ 🫂  @yekandrina - куратор программы по Приморскому краю"
republicans_vrn,channel,Воронежские республиканцы 🇷🇺☀️,94,Региональное сообщество неравнодуных граждан и местных иницатив — для развития Воронежа и области.   ☀️ Основа — республиканская философия общности и общего блага.   🇷🇺 Федеральный союз — @alliance_republic
zdravstvui_volshebnik,channel,"""Дерево желаний 2025"" Волшебники",144,"🎗 ВСЕРОССИЙСКАЯ АССОЦИАЦИЯ ОНКОЛОГИЧЕСКИХ ПАЦИЕНТОВ ""ЗДРАВСТВУЙ"" https://www.russcpa.ru/ В преддверии Нового года мы запустили акцию ""Дерево желаний"" —  ищем добрых волшебников, готовых исполнить мечты детей, страдающих тяжелыми заболеваниями."
sunevalore,channel,"Хотела стать солнцем, стала ☀️",278,"Тут про всё: работу, жизнь, вожатство, учёбу, чувства"
querencia,channel,Querencia⚜️,163,"(N.) a place from which one's strength is drawn, where one feels at home; the place where you are your most authentic self."
xxl_woofia_brasil,channel,XXL WOOFIA BRASIL🇧🇷,418,"Canal dedicado para do Jogo 18+ XXL WOOFIA para os jogadores brasileiros. Não somos uma conta official do jogo, só queremos passar a informação aos jogadores brasileiro."
montebravoinvestimentos,channel,Monte Bravo,418,"Queremos ficar ainda mais próximos de nossos clientes. Por isso, chegamos no Telegram!  Vamos trazer conteúdos de nossos especialistas, vídeos, podcasts e as principais novidades da Monte Bravo especialmente pra você."
cabrasenred,group,Como una Cabra,339,🎯 Queremos que emprender sea más fácil y menos solitario  👩‍🎨 Creemos en otra forma de hacer negocios ♻ 🗣️ Apostamos por lo rural y por una vida sostenible
apuestasdeportivasfsgratis,channel,APUESTAS DEPORTIVAS FS,288,"Canal de apuestas deportivas totalmente gratis, apuestas seguras, combinadas de alto valor, FUNBET!!  Queremos repartir dinero, cada día trabajamos duro para obtener los mejores resultados!!    📲 @FSeron"
nacsoglasie,channel,АНО Национальное согласие,41,"Наши цели - укрепление национальной безопасности, улучшение системы образования, межэтническое единство.  Наше будущее в наших руках. Патриотизм | Здоровье | Знания"
dobroinkavkaz,channel,Ресурсный центр «Доброволец Кавказа»⚡️,155,"Присоединяйся к команде волонтеров! Будем творить добро вместе💛   Входим в состав Ассоциации волонтёрских центров.   Сообщество ВКонтакте: https://vk.com/dobroalaniagroup  📍Проспект Коста, 93, г. Владикавказ, РСО-Алания."
presenciapura,group,PRESENCIAPURA,241,¿Qué significa #PRESENCIAPURA? Un movimiento de personas que queremos Vivir  de manera ilusionante♥️.  Re-programar tu mente es fácil si sabes cómo 🧠.  Siente-Confia-Fluye. La energía y la buena vibra se contagia! Vamosssss!!!!
competitiveexams01,channel,Competitive Exams,139,Admin ✆➛ https://t.me/Competitiveexams01 ••••••┈┈┈┈┈┈┈┈┈┈┈┈┈┈┈┈┈┈┈┈┈┈ अपनी कोशिश को तब तक जारी रखो  जब तक आप की जीत एक इतिहास ना बन जाए! ••••••┈┈┈┈┈┈┈┈┈┈┈┈┈┈┈┈┈┈┈┈┈┈
oposicionesfcse,channel,📚 Oposiciones Policía Nacional,1161,"🔔 Canal de OpositaTest para recibir información y recursos de las oposiciones de Policía Nacional.   El camino a la plaza es duro, pero no tienes por qué hacerlo solo. 💪👮‍♀️Aquí no competimos, aquí colaboramos.  ¡Vamos rumbo a Ávila! 🔜"
competitionflying,channel,Записки компетитора,410,"Приветствую тебя, влюблённый в небо! Этот канал создан для освещения соревнований, в которых я участвую, и других тем, связанных с парапланами и лётными местами. Автор и пилот: Альберт Абдуллин"
kurchatsport,channel,КУРЧАТОВЕЦ – школьный спортивный клуб,258,
molodejj_kurskoi26,channel,Курский молодежный Центр🔅,512,Все о жизни молодежи в Курском округе и за его пределами! Созидаем и генерируем нашу жизнь вместе!☝️ 88796464892
anaistay,channel,𝐥𝐦𝐥𝐮,2656,рада приветствовать вас в моём тгк о скизах и жизни 🩷  правила: https://telegra.ph/pravila-lmlu-06-20 tiktok: anaistay_ анон: @anaistayanonbot буст: https://t.me/boost/anaistay
tradecriptomundi,channel,"(( NEWS - 📢 TRADE CRIPTO MUNDI )) - Análises de Bitcoin, Nano, com + Criptoativos e Serviços de qualidade 💶🐋",715,"🎲 Trade Cripto Mundi 👨🏻‍🏫  Análises Gráficas, fundamentalistas, e Notícias diárias do mundo financeiro  de Criptoativos.   Serviços de trade em Criptoativos  www.tradecriptomundi.com   Trader Analista : @dono_tradecriptomundi  🤖= @tradecriptomundibot"
analisegeo,group,AnaliseGeo 🌎 Geo 4.0,195,Georreferenciamento de Imóveis Rurais e Tendências das Geotecnologias - www.analisegeo.blog.br
psychologyalta,channel,Психолог /Крым /Ялта. Дарья Граматикопуло,612,https://t.me/psihodostup_bot?start=start Платный тг Онлайн консультации🌍 Очные консультации📍г. Ялта  Групповые ZOOM встречи для женщин📲 Инстаграм: https://www.instagram.com/prof.darya  📲Запись  по телефону: +7 (918)9727725
auelista,channel,Компания АЮ,187,"Центр сопровождения программ и информационных продуктов фирмы «1С». 💻 Продажа 1С, обновление, линия консультации и тех. поддержки; обучение 1С, ККТ и ТО. 💡 Читайте интересную информацию, следите за новостями и получайте «приятные» бонусы! ☎️ 884722 5010"
znakomstva_nsk_24,group,[КОСМОС] Знакомства Новосибирск 18+,6085,"➤ telegra.ph/HAB--Novosibirsk-KOCMOC-04-05  ⭐️ Без ограничений только для VIP!  ‼️ ЗАПРЕЩЕНО: Вирт, реклама, нагота, наpk!  Реклама/Вопросы: @kost_repub"
gsm24server,channel,Gsm24Server Official Notice Group,342,🤝𝗪𝗲𝗹𝗰𝗼𝗺𝗲🤝 𝗧𝗼𝗼𝗹𝘀/𝗕𝗼𝘅/𝗗𝗼𝗻𝗴𝗹𝗲/𝗔𝗰𝘁𝗶𝘃𝗮𝘁𝗶𝗼𝗻 /𝗖𝗿𝗲𝗱𝗶𝘁 𝗦𝗲𝗿𝘃𝗲𝗿  ✅WhatsApp wa.me/+8801981575049 🌎 WEBSITE : Gsm24Server.com 👉 Following Group 🙏https://whatsapp.com/channel/0029VaVShAeDp2QFYY24Rp2t
ninebot_max_g2,group,Ninebot MAX G2/G65/Max2🛴,1330,Посты и другие виды рекламы запрещены!  Чаты по другим самокатам: @ninebot_max_g3 - чат по Ninebot Max G3 @SegwayZT3Pro - чат по Segway ZT3 Pro @SegwayGT2_GT1_P100S_P65 - чат по Segway GT Series @Ninebot_E3_Pro чат по Segway E3/E3Pro
teapuestooficial,channel,Te Apuesto - Oficial,1299,¡Descubre la emoción de las apuestas deportivas en Te Apuesto! Apuesta en tus deportes favoritos y eventos en vivo con las mejores cuotas. ¡Únete a nuestro canal para todas las novedades y promociones!
golazobets_apuestas,channel,GOLAZOBETS,917,https://golazobets.com  📬 @golazobets_info  🔞 Juega con responsabilidad
olimpo_apuestas,channel,Olimpo Apuestas,380,Plataforma de pronosticadores deportivos desde 2015 Apuesta con responsabilidad 🔞  También contenido #FPL  🔗 https://www.olimpoapuestas.com/
apuestescom,channel,☘️Apuestes.com ☘️,1601,"Canal oficial de la web www.apuestes.com donde informaremos de las novedades, promociones de nuestros Tipsters Premium y los mejores pronósticos premium gratuitos.  ⚙️ Soporte : @apuestes_support 🧑‍💻 Admin : @apuestesadmin 🧳 @apuestesoficial"
apuestasprofesional,channel,ApuestasProfesional,66,Canal de apuestas con pronósticos estadísticos con alto win rate https://solo.to/apuestaspro
aesta_a,channel,эста .✶,446,вы волки🐺   инфопост: https://t.me/aesta_a/4722 анонка: @aestashoditsuma_bot
betapuestaes,channel,BetApuesta,385,CERRADO POR MOTIVOS DE SALUD  Antigua plataforma con servicios Free y Premium de recomendación de pronósticos deportivos.  🔞 Prohibido a menores de 18 años.  ⛔️ El juego puede crear adicción. Juego responsable.
apuestas_tenis_aricastilla,channel,Apuestas Deportivas | Tipster Ari Castilla,152,
apuestasrfef,channel,Apuestas RFEF,130,
brasileogasa100real,channel,Brasil e o gás a 100 real,17182,Aqui mostramos a realidade brasileira e o porque dos mesmos merecerem gás a 100 pila   Owner: @TheK3D4Y  in memoriam @euyunkDi 🔱
faith0_0ful,channel,𝗙𝗮𝗶𝘁𝗵'𝖿𝗎𝗅 (🥕),728,"ⁱ'ᵐ ʰᵉʳᵉ ᶜᵃᵘˢᵉ ᵏⁱˡˡⁱⁿᵍ ⁱˢ ᵇᵃᵈ        𝖺𝗅𝗅 𝖺𝗋𝗍𝗌  ,  @faithfocused  ᵃⁿᵒⁿ'  t.me/HidenChat_Bot?start=74698359"
corazones_solitarios,channel,Corazones 💔 solitarios,3940,"Soy un corazón solitario, aprendí a soltar, a seguir adelante aún en medio del dolor... Porque supe hace mucho, que es mejor avanzar que quedarse donde no hay amor 💔  Si te identificas... ¡Únete!  Bot amigo: @Consejosparaescribir_bot"
memesmentalrelax,channel,Random memes for survival mode,1235,"Memes random, ilustraciones, data y bizarreadas porque puedo"
comoqueporque,channel,CómoQuéPorqué,499,"Ideas, soluciones, curiosidades y noticias"
chernichku,channel,ЧЕРНЬ(ичечка)🖤,177,
verdaderoperonismo,channel,️Verdadero Peronismo ✌️🇦🇷,751,"Militando por los principios sociales: ayer, hoy y siempre, porque ""la Patria es el otro"""
paulinaviptrans,channel,Paulina VIP,978,Acá te muestro adelantos bien calientes y previews que te van a dejar con la japi 🍆dura y la colita con ganas 😏🔥🍼 Suscribite y quedate cerca… porque siempre hay más 💎🔥
kurama1x5,channel,убежище курамы,384,
xnsing,channel,армагеддон мракобесия ༄,85,Приветствую друга на тропе самосовершенствования 🩶
nabatatsociety,channel,انـجمـن نبـاتـاتـــ 🎈,262,cubitum eamus? ☕️🕰️🧦🦇  • t.me/HidenChat_Bot?start=6314638160 •
viralizar,channel,🔮 Ácido Argentino II ⚽️🏆,333,"porque las segundas partes, lo bueno, siempre vuelve, dos veces bueno, nunca fueron buenas"
chatroomalemanologia,group,ChatRoom🗣🇩🇪,477,"Practica tu alemán todos los días, porque solo así vas a aprenderlo🤓  Aquí todos nos equivocamos, aprendemos de las conversaciones ajenas y repetimos como loros🐦😛  En menos de lo que imaginamos ya estamos hablando alemán perfecto🏆"
milideaspararegalar,channel,Mil ideas para regalar 🎁,345,Porque tú tienes que hacer un regalo y nosotros tenemos un montón de ideas. Este es tu sitio www.milideaspararegalar.es
connlect,channel,Ghostmisty.,361,"Coraje, resiliencia, fuerza, belleza poseída por un ser humano muy encantador, una figura muy venerada por quienes lo rodean. Y tal vez si necesitas esa figura humana, porque está vinculado a:  Phoenix, puedes encontrarme para: @demomn and @Deathwaybot"
iwa_peach,channel,✨причины любить себя ✨,50,
