crackiosvn,channel,CrackiOS VN,2611,"⭐Hack --> FreeFire, LiênQuân, ZingSpeed, Mini World, 8BallFool ➡️https://t.me/addlist/YvDWfm3WpQMzMTY1  ✅Admin: @ninhiosvip"
brokenarrowclub,group,Broken Arrow | Сообщество,1064,
hackedchattm,group,𝐇𝐀𝐂𝐊𝐄𝐃 𝕔𝕙𝕒𝕥 🇹🇲ᵀᴹ,1228,
account_cracked,channel,هکر,163,
welsonee3,channel,welsonee,389,По вопросам:  @Aoxofwarr @wwegonebeok
atascrackedversion,channel,ATAS Cracked Version,2048,Tech support
ke1lyinf,channel,ⲧִ.ოׄꫀ🍡ׄ / 𝐊EL𝖫Y #Iꪀִf꯭,304,открытие-29.03.26 владелец-@llillvs 🍡 порт-@nayalip tiktok-@viwiesfldd_com читается кэлли.  —like the stars morning the sun in the morning skies @WEAREno1FLOOD🤍
l0oo0f1,channel,𝐇𝐞'𝐬 𝐍 .,539,- TV's 3:10 . - Thor - Powerbuilder - Med student . - I was a fool Playing by the rules .  IG: primal.nawar  @Itsn4w4rbot  NGL: https://ngl.link/7heisthor7  SPOTIFY: https://open.spotify.com/playlist/448RxtI8xd1FDmRmeXXSP6
hyeonning,channel,yours hyeonning’^,24,"э, а шо писать то.  ну dance, harp, sleep, music."
punyaocy,channel,memo ocy,1,
lemonitang,channel,Lemontang « COMEBACK HEARTS2HEARTS »,1,Contact @jeongleeaa
lemontangcomeback,channel,"HYPE H2H RP-ERS, COMEBACK 🍋",1,
medgurutv,channel,MEDGURU,394,Лучшие врачи страны отвечают на ваши вопросы.
minecraftkanal11,channel,Майнкрафт моды бедрок,582,"👇Ребятки, по поводу рекламы писать сюды👇                          | @Diggsale |"
mods_marshal,channel,marshal,216,"Кто посеет ветер, тот пожнёт бурю. владелец : @marshal_096"
modcombo_net,channel,ModCombo.net Minecraft PE Mods,115,ModCombo.net - The Ultimate Hub for Minecraft PE
maemomeegoapps,channel,MeeGo/Maemo Channel,311,"Maemo/MeeGo Channel with apps, games, tricks, tips and everything related to Maemo and MeeGo.  Group: @linuxmobile_world"
danilichidev,channel,Danilichi Dev,37,"Всем привет, тут буду размещать посты о своей деятельности в геймдеве."
ohmyruhhh,channel,BMA SHOP (CODM),84,Owner: @Omahrohh
modegames,channel,ModeGame - Турниры по киберспорту,35,Создатель - @m0dex
bedrock_geming_uzb,group,❖BEDROCK GEMING UZ GROUP❖,11,Hammaga salom Bedrock gamer ni guruhiga hush kelibsz Bu guruhda Minecraft uchun mod va boshqa narsalar tashlaboriladi  Youtube kanalim :https://www.youtube.com/@Bedrock_gamer_uz  Qoidalar 1 So‘kingan  mute 4h 2 admin bering degan 2h 3 aldagan 9h
c_filatov,channel,Constantine Filatov,216,
lavierajewelry,channel,LAVIERA,804,"Здравствуйте! Меня зовут Анна. Изготавливаю украшения на заказ с персональным подбором камней 💎 Мои мастера имеют опыт длиною в жизнь🌏  Все камни официально ввезены в РФ, изделия проходят контроль пробирной палаты."
linyar,channel,линуар,317,"22, entj  Always remember that my heart holds you when my hands can’t.  [ книжные витрины; фолианты на иностранных языках; христианство; природа и любовь к животным ]  для связи: чат канала"
lesifolianty,channel,лес и фолианты 🧝‍♀️,225,📖 Между страниц — мох и тишина 🌿 Здесь читают под шёпот листвы 🕯️ Цитаты. Книги. Эльфийская эстетика
tdpapillons,channel,ТД Папиллонс,188,🔎 Здесь вы найдёте самое главное и интересное в мире широкоформатной и интерьерной печати.  Наши контакты  Сайт: tdppl.ru   Телефон:  +7 (495) 933-37-56  E-mail: msk@tdppl.ru  Дзен: https://zen.yandex.ru/id/61aa2b61caddb971fd61259c
freeliquid,group,Freeliquid Protocol,27,
flowmira_chat,group,цветы мИра,139,связаться со мной @ira_flowmira
investaza_communication,group,ФL - общение,108,
brilliantia_murmansk,channel,Бриллиантия - ювелирные украшения в Мурманске,11,"✨Ювелирная мастерская   💍  Магазин ювелирных украшений с бриллиантами   •Изготовление, переплавка из вашего золота •3D моделирование, индивидуальное изготовление  👉 ВКонтакте vk.com/brilliantia  г. Мурманск, ул. Самойловой, 12 м-н Север-Маркет"
blisterprom,channel,"Блистерпром: Блистерная упаковка, блистеры, Москва",17,"Производство различных видов упаковки из пластика: блистеры, коррексы, ложементы, упаковка Flow pack. Адрес: г. Щёлково, ул Московская 70а  Телефон: +74959796925 Сайт: www.blisterprom.ru Есть вопросы - пиши @nofear1979"
juma_collection,group,viruli_fulfillment,23,ФУЛФИЛМЕНТ | КАРГО | БИШКЕК - МОСКВА
folderlabs,group,Folderlabs Official,9,"Folder Protocol(FOL) is decentralized storage project with layer-2 solutions, seeking to safely store and send larger batches of data more adequately.  https://www.folderlabs.io"
mylomond,channel,MyLomond,5,"Телеграм-канал интернет магазина MyLomond, в котором представляем наши новости, отвечаем на вопросы, консультируем и помогаем с выбором материала"
atlantasolutionsbot,bot,FreeLanta Solutions | Фріланс проєкти,,Фріланс-агрегатор для активних людей. Завжди актуальні замовлення для фрілансерів. Щодня сотні нових пропозицій.
helvetica812,channel,Гельветика+ (СПб),3,"МАТЕРИАЛЫ ДЛЯ РЕКЛАМЫ, ДИЗАЙНА И СТРОИТЕЛЬСТВА. Самоклеящиеся плёнки, листовые материалы, POS, светотехника, багетпрофили..."
fulfilment_sellers_bot,bot,Фулфилмент Sellers,,
rebooks_me,channel,ReBooks Channel,24962,Канал книжного сервиса  Сайт: rebooks.me Бот: @rebooksmebot Поддержка: @assistent
olegroy_toyroy,channel,Олег Рой. Toy Roy,4421,"🇷🇺Писатель, сценарист, продюсер, общественный деятель.  🪶Председатель комитета по духовно-патриотическому воспитанию Российского книжного союза.  📄Проекты «Страна счастья», «Русские супергерои», «Дракоша Тоша», «Шмяк. Волшебная лавка Есении», «Супер Мяу»"
booktaverna,channel,Книжная Таверна,1204,Наш уютный чат: https://t.me/+rKG-COHnadZjMWZi  Наша группа ВК: https://vk.com/booktaverna  Предложить пост - @BookTavernaRoBot или личка в канале!   По вопросам сотрудничества - @taverna_admin
naidennayakniga,channel,Найденная книга,546,"Книжный канал от благотворительного проекта ""Спасибо!"".   Выкупить бронь можно будет в нашем магазине ""Спасибо!"" по адресу ул. Звенигородская, 6, каждый день с 11 до 21."
books_love_story,channel,Книжная любовная история 💘,930,Магазин книжного мерча 📖
dom_knizhki,channel,Книгсики,1858,Книжное племя главного книжного Петербурга @domknigisinger  Сообщество в ВКонтакте: https://vk.com/knigsiki_club  Вождь: @ksenigorbunova
alekssa_book_moto,channel,Дневник книжного блогера📚📚📚,1088,Книжный блогер Здесь: Книги📚 Мот🏍 Города🏙 Еда🥘 Места🖼 Для связи  @aleksa_book_moto
knijnayapolka,channel,Книжная полка,615,Аукционный дом
maxgoodz_family,channel,MAXGOODZ FAMILY,2400,✔️Блокноты и аксессуары для художников  САЙТ С БЕСПЛАТНОЙ ДОСТАВКОЙ ⬇️⬇️⬇️ https://maxgoodz.ru/shop  ✅OZON  https://ozon.ru/t/Wkk1LQy  ✅WB  https://www.wildberries.ru/seller/85482  ✅Для доставки за границу - hello@maxgoodz.ru
papeleriaonline,channel,📙Papeleria Online✏️,1368,💈 Todos nuestros canales: @CanalesLista 👤 Contacto: @Kuandoo 📩 Mail: canalesOfertas@gmail.com  ℹ️ Los enlaces incluidos son de afiliado.
akhavanpaper,channel,اخوان کاغذ,214,گروه اخوان کاغذ،اولین و بزرگترین گروه و فروشگاه اینترنتی پاکت و کاغذ در ایران شماره هاي تماس( درساعت کاری) :02156549363 ////09125174404 /// 09391506291             www.akhavanpaper.com  لینک سفارش :https://akhavanpaper.kalaban.app
art_baraholka_hudozhnika,channel,Арт Барахолка Художника,1305,❇️ Объявления присылайте сюда: @JuriArisu ⚡Бесплатные объявления о продаже/покупке худ. материалов с рук. ⚡Барахолка не несет ответственность за недобросовестных продавцов. Подробнее: https://t.me/art_baraholka_hudozhnika/4270 ❗️Рекламу не публикуем.
moexnewseveryday,channel,Мосбиржа. Новости,1719,"Новостной канал «Мосбиржа. Новости».  Каждый новостной пост содержит динамику по бумаге за день, неделю и месяц. Несколько раз в день отображается информация о ходе торгов. По вопросам: @Beekinz, @MoexNewss"
belovaartshop,channel,МАГАЗИН ИСКУССТВА БЕЛОВОЙ,559,"Канал галереи B AG. Здесь вы можете приобрести произведения современного искусства. Казань, Кремлёвская 9а. Доставка в другие города.  По вопросам приобретения: @l_0222 @Belova_art_gallery  Анонсы и новости галереи: https://t.me/BELOVAARTGALLERY"
pendorasbox,channel,Pendora's box 𐃈,554,She/her My instagram: pendo.ra https://www.instagram.com/pendo.ra?igsh=MXR5MngwN2lxcWNkcw==  Message me!: @Pendoranon_bot
artcoffee22,channel,АРТиКОФЕ🎨|ART&COFFEE☕️,617,Блестящая акварель ручной работы.✨✨✨Картины. Скетчи. Арт-материалы. 🌿 Для связи Анна https://t.me/+79235661018 🌿 Болталка по ссылке https://t.me/+b1A8azkU4ssyZGJi
abris_m,channel,"Абрис-м: типография, фото-, копицентр",215,Звонки: +7 495 476-62-62 Вотсап: https://wa.me/74954766262 Телеграм: t.me/abrism24_bot Почта: abris-m@inbox.ru
daemontsey,channel,daemontsey,606,"Я бы хотела, чтобы этот мир остался на бумаге"
luxuryhouse21,channel,𝑳𝑼𝑿𝑼𝑹𝒀 𝑯𝑶𝑼𝑺𝑬 | 21+,884,Для вступления обращаться в @Luxuryhousekf_bot При себе иметь фото документа с датой рождения и юз на бумаге.
maztoss,channel,ℳ,152,"Assemblage of old and new works  tachisme, informalism"
artrama_baget,channel,Арт-Рама. Сеть багетных мастерких,489,🖼️Крупнейшая в России сеть багетных мастерских  ▫️Москва — 30 салонов ▫️Санкт-Петербург — 5 салонов  ▫️Срок выполнения заказа от 20 минут ▫️30 лет успешной работы  🌐www.art-rama.com
bubliklive,channel,ANDY BUBLIK,838,"Штрихи на бумаге, Цвета на айпаде.  Коммерческий иллюстратор с опытом работы более 10 лет.   Органичное сочетание традиционной и компьютерной графики.  Личка — @andybublik Ссылки — https://taplink.cc/andybublikdraw"
hpmor_chat,group,Чат о ГПиМРМ,396,Правила чата: https://t.me/hpmor_chat/46888 О книгах на бумаге: @hpmorprint
lavka_mebel,channel,LAVKA | мебельная мастерская,444,"Мебель по дизайн-проекту, эскизу на бумаге, фото из интернета  Расчет за 2 дня 👉🏻 @lavkamebel"
anna_vasilchenko_writer,channel,Анна Васильченко | Волшебный писатель,341,Мои книги В бумаге 💜 «Наследница» — мистико-приключенческий роман. Издательство: «Маракуйя»  Электронные: 💙 «Проклятые ночи» — городское фэнтези 🖤«Мрак сердец наших» — эпичное фэнтези в собственном мире.  Скоро в бумаге. Пока читайте на ЛитРес.
gspec,channel,Ухо Гераклита,611,"Ухо Гераклита - это инструмент улавливания стихийных мыслей, место описания внешних стихийных, не достаточно нормальных явлений - «давайте испытаем это», но ...ценности в них будет немногим больше, чем в чернилах, оставшихся на бумаге, или в ученых спорах"
dve_bukvy_shop,channel,две буквы shop,31,работы @dve_bukvy по приятным ценам  для покупки пишите в комментариях  отправляю по России или вручаю лично в Москве
kawaiiaskenii,channel,Askenii глупая | кмм √,206,Рисую на туалетной бумаге  Создательница - @Askenii
rukobludie_otvaga,channel,Рукоблудие и отвага,117,"Одна ошибка — и ты ошибся. ©  Или история о том, как я букбайндинг осваивала 📚"
tohtobinaartstore,channel,Tohtobina ART store,95,Актуальные к покупке работы
komon_club,group,"KOMON | велоклуб, велозаезды",376,Велосообщество ✌️ Свободное общение всех участников на велосипедные и сопутствующие темы
komnplay,group,KomNPlay Official,125,Get to know more about KomNPlay : 1. Web : https://play.kommunitas.net 2. Android Download : https://play.kommunitas.net/komnplay-app 3. Docs : https://docs.kommunitas.net/games/komnplay 4. FAQs : https://play.kommunitas.net/faq
komkus1920,channel,Հայկոմկուս (Компартия Армении),97,Ալիքը ստեղծվել է Հայաստանի Կոմունիստական կուսակցության նախաձեռնությամբ՝ կուսակցության գործունեությունն ու գաղափարները հանրության լայն շերտերին ավելի հասանելի դարձնելու համար։
kfcompotan,channel,Compot CONFESSION,84,
komplistore,channel,😍,17,
compercom,channel,Комитет Переименования Коммунизма,34,Это название пришло ко мне во сне. Интернет микроселебрити.
comiglobal,group,Comi | Global Community,53,Comi: https://comi.io/ Channel: @comichannel Twitter: https://twitter.com/Comi_io
coolzone_khabarovsk,channel,Комбинезоны Cool Zone KOMBEZDV.RU,85,"Официальный представитель Cool Zone в Хабаровске Можешь прийти в магазин в Хабаровске по адресу Краснореченская ул., 97А (этаж Цокольный)  или заказать на сайте  🔴⚪️🔵https://kombezdv.ru/"
commscf,channel,commisions confessions! [ТОЛЬКО ВП ДО 30ПДП],21,
ipsos_in_russia_chat,group,Ипсос Комкон Чат,68,Хотите заказать исследование? Есть другие вопросы? Ждем ваших сообщений через наш бот @ipsos_in_russia_bot
comankalitero,channel,Кадровый ЭДО Коман,16,"Электронный кадровый документооборот, который всегда под рукой.  Объединяем работников и работодателей, бизнес-процессы и кадровые документы в одном сервисе!   https://www.coman.cloud/"
comlite73,channel,КомЛайт,9,Мы решим все Ваши проблемы в сфере it e8bh8wf3vtfsrec9
kommodin1,channel,kommodin,2,"Noticias y reflexiones sobre el uso de tecnologías en proyectos comunitarios, sociales, culturales y ambientales"
infocmw,channel,𝕴𝐧𝐟𝐨𝐜𝐦 𝐚𝐬𝐬𝖔𝐜𝐢𝐚𝐭𝐢𝐨𝐧 𝐜𝖋,10,идея взята у : https://t.me/sweet_escm  @associnfocm_takebot бот для тейков
conmy_brand,channel,CONMY BRAND,5,"SPORT STREET AESTHETIC BRAND. Мы верим в свободу самовыражения и создаем стиль, который помогает каждому найти свой уникальный путь   • Служба заботы ➡️ @conmy_askme • Работаем ежедневно с 10:00 до 22:00  • Действует Т-Рассрочка и оплата сервисом “Долями"
cmoncmon_bot,bot,cmoncmon bot,,cmoncmon.co
comoonru_bot,bot,COMOON - Кемпы для удаленщиков,,"Кемпы без отрыва от работы, в клевых локациях и с крутыми ребятами. Закрытое комьюнити."
ipsos_in_russia_bot,bot,Ipsos_comcon_bot,,Ipsos. Маркетинговые исследования и анализ поведения потребителей.
komtender_help_bot,bot,Комтендер - Команда поддержки клиентов,,Рады ответить на ваши вопросы. Пишите! В этом чате - человек :) https://www.komtender.ru/ +7 495 646-14-25
dot_comms_bot,bot,Dot Comms,,"Это бот консультационного агентства Dot Comms, работающего с локальными брендами"
combinepppbot,bot,Комбайн аккаунтов РРР,,Импорт в антики и автозаливы. Проход чекпоинтов и ЗРД. Получение кода на почту и 2fa. http://combineaccounts.space
comancloudbot,bot,Коман Поддержка,,Поддержка пользователей Коман в рабочие дни с 10 до 19 по московскому времени
komus_clubbot,bot,komus,,Официальный бот компании «Комус»  Подписывайтесь на наш канал @komuscom
kompass_media_bot,bot,Компас — обратная связь,,Бот обратной связи @kompass_media
comacoma_bot,bot,coma-coma,,Российский мебельный бренд Coma
cumdeus_com,channel,CUMDEUS.COM,1,GEMEINSCHAFTSPROJEKT FÜR ENTGRENZTES SEIN.
kmc_com_bot,bot,kmc_com,,Связь с редакцией.
bookflyingcloud,channel,☁️Книжное летающее облако☁️,3339,"~Для связи - @MessinaFonCloud🕊  🌿•◦Меня зовут Лена, я обожаю Азию и все что с ней связано◦•🌿   ~В закрепе: • навигация  • все о канале🍂  Выпей чашечку зелёного чая и оставайся~ ☁️Добро пожаловать в облачную обитель☁️"
kulmatova_decorpaper,channel,Мраморная и другие декоративные бумаги в истории оформления книги,578,"Авторский канал Татьяны Кульматовой о мраморной и других декоративных бумагах, о сопутствующих им элементах книги и книжного переплёта.   Группа для обсуждения: t.me/marbled_paper"
knizniydesigner,channel,книжный дизайнер | валерия шило,592,"о работе арт-директором в издательстве «МИФ», книжном дизайне и любви к своему делу  оформляю серию классики «вечные истории», цикл «...из Габена» и многое другое"
bookboulevard3,channel,Book Boulevard 📜,351,Book Boulevard - твой спутник на бульваре книжных открытий 🛰📖✨  Для связи: @V_v_V_393 @jam_1310
mxskrosh,channel,mxskrsh👺,460,Канал с готовыми обложками: https://t.me/mxskrsh_covers По всем вопросам/предложениям: t.me/MXSKRSH
olya_infografika_mp,channel,Ольга Абдулина | Дизайн карточек | Нейросети,157,"Канал про инфографику, которая помогает продавать на маркетплейсах  Чистый дизайн и понятные смыслы без ""визуального шума""  ✍️ Заказать дизайн: @olya_abdulina"
underrhythm,channel,UnderRhythm,260,Читайте закреп! Тгк проекта по сайту с музыкой Андертейла и оригинальными обложками от разных художников.  Подавать анкеты\список участников - сайт в закрепе - Набор открыт всегда! щп - t.me/Shitpost_UnderRhythm анон - @underrhythm_anon_bot
mastera_perepleta,channel,Мастера переплета,90,О переплете и реставрации книг красиво и со вкусом😋
k_o_ma_ya,channel,к☄️ма | обложки | арты,167,"""кома"" - цифровой художник, занимающийся в основном обложками для треков. https://vk.com/k_o_ma в прошлом мура/muritenomi/myaomur"
cozyknitsshark,channel,𝐂𝐎𝐙𝐘 𝐒𝐇𝐀𝐑𝐊 🎀,209,Здесь акула вяжет для вас с любовью 🎀
moth_sketch,channel,Мотыльковые скетчи,81,"Зарисовки, мысли, уютные диалоги https://boosty.to/minmay"
ai_content_infografika,channel,Нейроконтент | инфографика,55,Тут рождается визуальный нейроконтент. Инфографика и нейрофото с упором на ваши задачи и желания!  Для связи - @VGrebennikova
musicrush,channel,Music Rush,148,"Музыка в Телеграм с официальными обложками, правильными названиями и системой поиска.  Предложить свою музыку, поделиться историей и отправить фидбек можно здесь: @musicrush_bot"
library_life05,channel,Мир между обложками 📚,89,"Здесь живут герои, дышат пейзажи и говорят строки. Присоединяйся к нашему книжному путешествию и открой для себя волшебство, скрываемое меж страницами книг!"
belyaeva_designn_pro,channel,Инфографика для WB/ Дизайн карточек,81,"👋🏻Привет, я Света  БЕСПЛАТНЫЙ РАЗБОР ВАШЕЙ КАРТОЧКИ ТОВАРА 👇🏻👇🏻👇🏻👇🏻👇🏻👇🏻👇🏻 @Belyaeva_Designn"
books_by13,channel,books_by13,14,
gorstdesign,channel,"Инфографика | карточки товаров | Дизайн для ВБ, Озон",54,"Разрабатываю дизайн для маркетплейсов под ключ с опорой на маркетинг  Инфографка и Рич-контент для Wildberries, Ozon. Нейрофотосессия  Показываю, что маркетинговый дизайн — важный элемент успешной стратегии продвижения товара  Заказать: @gorstangelina"
fotokniga_krd,channel,ФОТОКНИГИ,70,ПРИНИМАЮ ЗАКАЗЫ НА ПЕЧАТЬ ФОТОКНИГ  📲 8-938-519-72-88  🪩 https://osinskayanatalya.ru/fotoknigi-1  MAX https://max.ru/join/CKvaIfvoJ5YBfy_7xRyO24oEDMYjOfrxCm9kmS  https://www.instagram.com/fotokniga_krd?igsh=djY2ZjBzY3J5NjEw  https://vk.com/fotokniga_krd
