mergita_mefthie_sechi,group,መርጌታ የባህል መድኃኒት እና መፍትሔ ሰጪ,53288,ከጥንት አባቶቻችን በተቸረን ሰለሞናዊ ጥበብ ተፈጥሮ ያበቃላቸውን የዕፅዋት መድሀኒቶች በመጠቀም ከፈጣሪ በታች መፍትሔ አለኝ 🙏0912856401 መርጌታ የባህል ህክምና 0912856401 ይደውሉ ። ማንኛውም መልዕክት ካለዎት👇👇👇          👉 Telegram           👉imo           👉 Whatsapp ላይ ያገኙናል
mergatayohanis,group,መርጌታ ዩሐኒስ ባህላዊ መድሀኒት ቀማሚ,29614,
master_abnet_shilmat_mekebeyauy,group,መርጌታ መላክ ታዬ ባህላዊ መድሀኒት ቀማሚና አዋቂ,43965,
mrgatagebre,group,መርጌታ ገብሬ የባህል መድሀኒት ቀማሚ,26487,0988465699
ku19me,group,መሪጌታ ዮሐንስ የባህል መድኃኒት አዋቂ,38834,
homesethio,group,መርጌታ ጥበቡ የባህል መድሀኒት ቀማሚ,11094,እፀ ፈውስ
mergtamengstttt,group,መርጌታ የባህል መዳኒት ቀማሚይ,10214,መርጌታ
meregitasolomo,group,መርጌታ ሰለሞን ባህላዊ መዳኒት,7899,
mergatademis0990069417call,channel,መርጌታ አባእንዳለ የባህል ሐኪም,5181,📞☎️0990069417ይደውሉ
mergetamengst21,group,መርጌታ የባልህ ሕክምና,26368,
temir_taqa,channel,TEMIR TAQA,351,🛠 Temir Taqa — Sifat va Halollik 💸 Moshina sotish va sotib olish 📩 Hamkorlik uchun: DM 🚀 Arzon narxlar faqat Telegramda:  t.me/temirtaqa
mebelzakazkattaqurgon,channel,Стильные Кухни,296,БУЮРТМА МЕБЕЛ   Мурожаат учун 91 556 00 35
memanddance,channel,MEM&DANCE,451,10 members Ссылки на все соц сети: https://taplink.cc/memanddance63  TikTok:  https://vt.tiktok.com/ZSFMkU1od/
metamerge,group,MetaMerge Official,161,Welcome to MetaMerge Telegram!  Announcement: @metamerge_news Website: https://metamerge.game/ Twitter: https://twitter.com/meta_merge Business/MKT inquiries: support@metamerge.game
baltmix98,channel,БалтМикс98,184,💪Нам более 11лет✨ ✅Надежная техника✨ 👷‍♂️Опытные операторы✨ 🗺Мониторинг 24/7 т.+7 (921) 569-98-98 ; +7 (993) 645-84-15 🕵️‍♀️Смесь опыта и знаний✨ 🤝Подпишись! Закажи! Проверь!✨ 🌎Наш сайт 👉🏼 https://baltmix98.ru/
chtresultbgmi,channel,𝐑𝐄𝐒𝐔𝐋𝐓 Cece 🔥🔥,205,Chanel acc @jualakunlynda  @Tinutan_CHT_Lyn
njitedu,group,男上加男工程学院交流群,51,机器人误封请私戳联系 @magic_ghosts 莫谈敏感话题，理性讨论，禁止广告 教务处公告通知组 https://t.me/njiteduchat 校友卡领取指南 https://mp.weixin.qq.com/s/hX3rY5NZQ-jGeLL2eo0JcA
autobukhara,channel,Авторынок Бухара,41,"Аренда, продажа авто по Бухарской области  По всем вопросам 👇 @Bukharabot"
akhbar,channel,کانال اخبار,540,https://fragment.com/username/akhbar  این کانال وابسته به هیچ خبرگزاری، سایت یا کانالی نمی باشد
akhbar_andimeshk,channel,اخبار اندیمشک,5113,اخبار لحظه به لحظه اندیمشک را با ما دنبال کنید.  اخبار و مطالب و عکسهای خود در مورد اندیمشک را از طریق این آی دی  به ما برسانید 🆔: @ygadmin 🌹🌹🌹🌹🌹🌹🌹🌹 _ _ _ _ _ _ _ _ _ _ _ _ _
shabakat_akhbar_alsuwyda_bdaqiqa,channel,شبكة أخبار السويداء بدقيقة,4059,
akhbar_iran_jahann,channel,اخبارایران وجهان | اخبار جام جهانی,3097,"📌اخبارایران وجهان  🔹️برای اطلاع از اخبار در سریعترین زمان از منابع رسمی با ما همراه باشید.  در پلتفرم های داخلی مارا با نام ""پایگاه خبری تمدن سفید"" دنبال کنید. ┄┅═✧☫تمدن سفید☫✧═┅┄ ｢➜• @tamadonsefid_ir｣           ادمین: @AadminN_313"
akhbar_mahvelat1399,group,اخبار مه‌ ولات,2476,◀️ با عضویت در کانال #اخبار_شهرستان_مه_ولات از اخبار شهرستان مه ولات آگاه شوید  🆔 https://t.me/akhbar_mahvelat    🚨 راه ارتباطی (( ارسال سوژه و تبلیغات))  🆔 @mahvelat_akhbar
kutubxona_chat,group,Kutubxona guruhi,698,BEPUL KUTUBXONA    Shu yerdan boshlang: t.me/mehr_kutubxonasi/129  Qoidalar: t.me/kutubxona_chat/25399  Murojaat: @kutubxonachi_1  Kitoblar ro'yxati: @mkitobot Sayt: mehrkutubxonasi.uz
kutubxona_comments,group,Muhokama/Comment‌‌s‌‌,146,"👋 Assalamu alaykum, guruhimizga xush kelibsiz! 🤓Eslatib o'tamiz! Bu guruh https://t.me/kutubxona Rasmiy kanalining 📚 @kutubxona_comments guruhi hisoblanadi. Guruhda yozayotganingizda axloq normalariga amal qilishingiz so'raladi❗️"
tarix_muarrix_kutubxonasi,channel,𝐊𝐮𝐭𝐮𝐛𝐱𝐨𝐧𝐚 𝐤𝐚𝐧𝐚𝐥𝐢,942,"📜 Tarix – o‘tmish emas, saboq Bu kanalda: 📖 tarixiy kitoblar, 🧠 muarrix qarashlari, 🏛 tarixiy voqealar va shaxslar jamlangan. Bilim izlovchilar uchun haqiqiy kutubxona!  🤲Inshaalloh 10 K🤲  👤 @Lazizbek_sharipov"
kumushkon_kutubxonasi,channel,Kumushkon Library with Marjona,265,"Bugun kitob o'qigan odam, 📚Kechagi odam emas.  🇩🇪 Germaniya granti hisobiga ochilgan Kutubxona faoliyati - 2022 yildan hozirga qadar Siz bilan🤍  🇺🇿 07.11.2025 yildan Ipoteka bank homiyligidagi Bilimxona yangi binoga o'tkazildi  ☀️Ilmga intilganlar uchun"
kutubxonachi_va_kutubxona,group,📚 Kutubxonachi va Kutubxona 📚,53,1)Kitob so’rash namunasi: #kerak Qiyomat📚 2)Chat mumkinmas❌  »  kutubxonachi.uz » @kutubxonachiuz » @KutubxonachiUzBot  Murojaat:  @HoppsBot
book121123,channel,Elektron kutubxona 📚,1203,
kutubxonachiqiz,channel,Kutubxonachi qiz,584,"Kanalda asosan Olot tumani, Muxtor mahallasida o’zim va do’stlarim tashabbusi bilan tashkil qilingan #MahallaKutubxonasi faoliyati haqida yoziladi. + shaxsiy fikrlar"
kutubxona_online_24,group,Kutubxona 7/24 online,54,Kitoblar_bazasi📚 Bazada 50 000 dan ortiq kitoblar📚   10 000 dan ziyod audio kitoblar🎧 Kitob uchun gruppaga odam qushish k Xaqiqiy kitobxonlar kerak👨‍🏫👩‍🎓 Chat qilganlar Reklamachilar Kanalimiz: @uz_baza11 Hamkorlarimiz: @Tibbiyotim_online_24
psixolog_kutubxonasi,channel,Психолог АХАДЖОН Кушаков,3453,Bizning kanalda  ✔️ Psixologik maslahatlar  ✔️ Dorilarsiz kasalliklardan halos boʻlish  ✔️ Ички қувватга асосланиб соғликни тиклаш; ✔️ Шахсий ривожланиш; ✔️ Лидерлик сифат; ✔️ Ўзликни англаш; @Psixolog_trener  Kanal manzili: @Psixolog_Kutubxonasi
otu_elektron_kutubxona,channel,Otu_elektron_kutubxona,726,Kanal
qizil_kutubxona,channel,Qizil kutubxona - (sheʼriyat),24,"Oʻzim* va boshqa mualliflar yozgan sheʼrlar, asarlar haqida yozaman. Eng yoqqanlarini joylayman."
karantinkutubxona,channel,KARANTIN KUTUBXONA,838,
elektron_kutubxona_7dan70,group,telegram_kutubxona-mutolaa,25,
kutubxona_hissadorlari,channel,Kutubxona hissadorlari,342,Bu kanal kutubxona hissadorlari uchun  Kutubxonaga hissa qo'shgan va savobidan hissadorlar  Alloh qodir qilganicha quyidagilar haqida yoziladi.  - Ehsonlar - Xarajatlar - Zarur kitoblar - Natijalar  Homiylik: @kutubxonachi_1  @mehr_kutubxonasi
oxirathovlisi_kutubxonasi,channel,Oxirathovlisi kutubxonasi,2985,https://t.me/oxirathovlisi_kutubxonasi
kutubxonachilar_akademiyasi,channel,Kutubxonachilar akademiyasi,551,"Bu kanal orqali kutubxonachilik sohasida bo'layotgan yangiliklar va kutubxonachi hayoti haqida bilib olasiz. Kanalda ish faoliyati uchun kerakli hujjat, taqdimotlarni qanday qilishni o'rganib olasiz. Murojaat uchun: @OlimovaGulnoraxon"
ctwlink,channel,ကာတွန်းကမ္ဘာ ( Fan Sub ) ❄️Links collection ☃️,78571,Link Collections
tenshi_collections,group,TENSHI Коллекции,2821,
cinemacollections,channel,cinemacollections,9910,Group 1 : https://t.me/+vUrK_FA97m1hODAy Group 2 : https://t.me/+vfpm8yc7RKRiNTE1  Bot 1 : @Anjalinabot  Bot 2 : @Anjalina_bot Bot 3 : @AnyTimeMoviesBot Bot 4 : @MovieSearchIt_Bot
tenshi_wear,channel,TENSHI,33330,Одежда с авторскими принтами  Сайт - https://tenshi-wear.com  Ассортимент - https://t.me/tenshi_collections  Отзывы - https://t.me/tenshi_review  WB - https://www.wildberries.ru/brands/312184060-tenshi/
magicnftcollections,group,VWS Mining Chat,13339,https://t.me/MagicVipClub https://t.me/VirtualsWorlds https://t.me/MagicVipPeople https://t.me/MiningChatbot https://t.me/MiningVWS https://t.me/AirdropVWSbot https://t.me/AirdropNftOpensea https://t.me/MagicNftClub https://t.me/ClickerVWSBot
mamescollections,channel,Alaminu's collections,865,አል-አሚኑ ጥራታቸውን የጠበቁ ግብአቶች መገበያያ መድረክ ነው Al-aminu collections is a platform that delivers quality day to day supplies to customers  Feedback፡ @Mamesha 📌NEW PRODUCTS📌NEW DEALS.   📲 +251938678509
alienist_collections,channel,Alienist Collections,427,🧨 YouTube  https://youtube.com/@alienist_collections  💸 Донаты  https://t.me/Alienist_Collections_Donate   📞 Сотрудничество  @alienist_of
elevenlabsvoicerbot,bot,Voice Bot,12097,Бот для озвучки аудио
sanyaradiotechnica,channel,Александр Власов пишет про звук,6797,"Контакт для связи - запись/сведение/мастеринг, менеджер: @VlasovStudioManager Мой Бусти: https://boosty.to/radiotechnica"
fctkobdotu_audio,channel,ФКТ Аудио,3263,"Аудио-версии выпусков ""Вопрос-Ответ"" В.В. Пякина и Фонда концептуальных технологий https://fct-altai.ru https://vp-sssr.ru"
akniga_13_arc,group,"БИБЛИОТЕКА Warhammer 40000 аудиокниги | АудиоАрхивы Императора (40k, AoS, Fantasy) 📚",702,БИБЛИОТЕКА Аудиокниг по: #Warhammer40k #WH40kAudiobooks #аудиокниги40k  Поддержать: 💳: 2204120122231885 https://plvideo.ru/@akniga_13 https://boosty.to/wizardio https://rutube.ru/u/akniga13 https://vk.com/akniga_13
audio_kitep_kyrgyzcha,channel,Кыргызча аудио китептер (Эрнис Кыязов окуйт)⇉,1888,Кыргызча аудио китептер (Эрнис Кыязов окуйт)  Кыргызча аудио китептер.  Кыргызча аудио окуялар.  Кыргызча аудио баяндар.  Кыргызча аудио форматтагы окуялар.  https://kyrgyzcha.site/  Онлайн кино ⇉ kino-do.com Онлайн аниме ⇉ space-anime.com
onfirescorp,channel,🔥OnFires🔥,1821,"Убежище корпорации автозвука "" В Огнях """
nstarikov_audio,channel,🎙️Николай Стариков. Аудио,4453,https://podcast.nstarikov.ru  На этом канале размещаются аудиоверсии видеороликов Николая Старикова.
boynextdoor_songs,channel,BOYNEXTDOOR SONGS,2657,аудио канал @boynextdoor_hybe
turkeyabout,channel,Повестка дня Турции,25584,Авторский канал журналиста Яшара Ниязбаева.   Наблюдаю за общественной жизнью Турции. Антропологический интерес и ничего личного.
oriental_aesthetic,channel,Oriental aesthetics 🌙,2280,"👩🏻‍🎓 Oriental aesthetic — это канал с интересным контентом об истории, культуре и современности Ближнего Востока и сопредельных регионов. Присоединяйся и открой для себя нечто новое! 🕌✨  ✍️По вопросам рекламы и сотрудничества: @Jafarii777"
muhajeerfund,channel,Фонд Мухаджир,560,Данный канал является официальным каналом фонда Дагестанской диаспоры в Сирии.
mihwarresistance,channel,Михвар // Mihwar.Ru. The Axis of Resistance,345,"Сопротивление в Палестине, Ливане, Сирии, Ираке, Йемене, Бахрейне. Культура Исламской Революции."
alpaladar,channel,Al-Paladar,140,Cada dia té el seu propi sabor
viktorbochkarev,channel,Виктор Бочкарев,232,Глава Анадырского муниципального округа Чукотского автономного округа   Администрация района: @anadyr_rayon
aladdinmamedov,channel,Аладдин Мамедов,232,"Депутат Думы городского округа «Город Чита» восьмого созыва, предприниматель и общественный деятель"
rkadyrov_media,channel,RKadyrov_Media,101,Мировая политика. Международные отношения. 📰 Хроника событий 📷 Фотоархив 🎥 Видеоархив 📝 Новости
pobediteli_1945,channel,Победители,300,"«ПОБЕДИТЕЛИ» — цикл интервью популярных артистов и телеведущих с ветеранами Великой Отечественной войны. В ходе откровенных бесед герои и ведущие обсуждают ключевые события Великой Отечественной войны, личные истории."
whyileftiran,channel,چرا از ایران فرار کردم؟,686,نه قهرمانم، نه قربانی فقط فراری.
habibhosseinifard,channel,Hosseinifard | گشت‌ها,853,
sila_v_pravde_zov,channel,Сила в правде,163,"Всем здарова! Канал про новости нашей страны и не только, важные памятные даты нашей Родины и многое другое.  https://t.me/Sila_v_pravde_zov_chat – чат для общения."
ententecordialeee,channel,Сердечное согласие || История,321,"История для олимпиад и жизни понятным языком!  По вопросам рекламы, сотрудничества и тд: @Golden_C0ck  Предложка: https://t.me/EntentecordialeBot"
informburo51,channel,Заполярное Информбюро,387,"Вместе проживем каждый день, приближающий к Победе."
reichsarchiv_buecher,channel,Reichsarchiv - Bücher bis 1945,982,@Reichsarchiv
pobeda_1945,channel,"""Бабушка приехала"" 😎",48,"АнтиПропаганда-Диванный эксперт: Новости, на которые стоит обратить особое внимание, обратная сторона Геополитики. #Украина #Россия #США #Европа #газ #мир#война на Украине #СВО#Трамп#зрада #перемога#наступление#Путин"
the_krasnogorr,channel,Krasnogorr,113,
sagesseeuropeene,channel,Sagesse Européenne,192,Europe Jeunesse Révolution Instagram: SagesseeuropeenneV4
aoruipeng_1995,channel,𝐀𝐨 𝐑𝐮𝐢𝐩𝐞𝐧𝐠,916,°‧🫧⋆ 𝔸𝕠 ℝ𝕦𝕚𝕡𝕖𝕟𝕘 .ೃ࿔*:･ اولین و معتبر ترین چنل بازیگر ائو روی پنگ جذاب 🫠🤍 اولین خونه کت چرمی کوچولوها 💕 ──  ناشناس : @AoRuipeng_Bot ── ارشیو : @DramaAoRuiPeng
iiiereichcalomnie,channel,IIIe Reich calomnié,513,Catholique NS https://t.me/catholique_ns
ww2history_new,channel,Вторая мировая война/WW2History,70,"Канал о Второй мировой мировой войне в фото и видео, а также в познавательных статьях.  Здесь нет пропаганды и оправдание нацизма и эктремизма. Все материалы представлены для ознакомления.  Для связи - @Ww2admin_bot"
ibrohim_cg,channel,Ibrohim Design,63,Kanalga o'zim qilgan ishlarni joylab boraman.  Taklif va savollar uchun: @ibrohimdsgn
ibrohimovv68,channel,𝐀𝐌,1119,нᴇ ᴨᴏɜʙᴏᴧяй ᴧюдяʍ ɜнᴀᴛь ᴏ ᴄᴇбᴇ ᴄᴧиɯᴋᴏʍ ʍнᴏᴦᴏ
ibrokhim_abdurakhmonov,channel,Ibrohim Abdurahmonov,2722,O’zR qishloq xo’jaligi vaziri  Министр сельского хозяйства РУз  Minister of Agriculture of the Republic of Uzbekistan   fb.com/ibrokhim.abdurakhmonov.7 Instagram.com/ibrokhim.abdurakhmonov twitter.com/Ibrokhimabdu5
http_lbrahim36,channel,Ибрахим,928,Добро пожаловать на мой канал!❤️  Фан аккаунт в ютуб:http://www.youtube.com/@ibrahi_m38 Мой канал в тик токе: https://www.tiktok.com/@lbrahim_709?_r=1&_t=ZS-94ovfmmFgH6 Фан аккаунт в тт: https://www.tiktok.com/@daniela_fan32?_r=1&_t=ZS-94hgdBUTIEG
tashkent,channel,🌄Midnight thoughts🌙,174,
favorarchivee,channel,favor.archive,2444,"Оплата принимается на счёт ФОП связь со мной - @onlycollectible  доставка заграницу 200грн доплата за вещь, 300грн за обувь  нашли дешевле? пишите - сделаю скидку  самые маленькие цены тут (вещи в наличии) - https://t.me/favorarchivestock"
matrona_russia,channel,MATRONA RUSSIA,5106,Интеллектуальные коллекции с футуристичными представлениями об одежде.
brands_alleya,channel,КАТАЛОГ БРЕНДОВ🔝КАТАЛОГ КЛУБ,227,Для связи с менеджерами  https://t.me/catalogbrandbot  Написать нам в канал  https://t.me/brands_alleya?direct
mintgallery,channel,MINT GALLERY,1515,"Мультибрендовый магазин MINT Gallery г.Владивосток ,ул Адмирала Фокина 20 +79990597554"
olgaclothes,channel,Одежда | Байер качественных реплик люксовых европейских брендов из Китая,320,"Гардероб из мира люкса. Реплики уровня 1:1. То, что вы искали. Ежедневное пополнение. По вопросам заказа и наличия — пишите в ЛС."
vegfun_plants,channel,Вегетация и Излишки,1122,Излишки коллекции растений.  Основной канал - @vegfun
collectlego,channel,КолЛего,197,Для коллег-коллекционеров конструктора Lego  Сотрудничество: @radiv12
bestsizeopt,channel,ОДЕЖДА ОПТОМ из Турции,921,СБОРНИК моделей из разных фабрик категории ЭКОНОМ / МЕДИУМ / ЛЮКС  Цены окончательные без доплат  Заказ ТОЛЬКО УПАКОВКАМИ (размерными рядами)  Доставка по Миру 🌏  Заказ через менеджера Максим @maksbestsize
pimplecollect,channel,Pimple collect 🍓,89,Мой картонный тгк 💘
keyoutlet,channel,Кейтчнутая,2302,ARCHIVE | OUTLET | SAMPLE  Архивные коллекции | аутлет | образцы | изделия со съемок | витринные единицы | позиции с небольшими изъянами💔   By KÉYTCHI
katyplants,channel,Katy Plants,1738,Нудное цветоводство в солнечном Краснодаре😂 Излишки коллекции https://t.me/KatyPlantsss Для связи @KatyVladimirova
pink_olivka,channel,Pink.Olivka🎀,1276,Каждой девочке по красивому бантику🎀 Лимитированные коллекции премиальных бантов ручной работы
animecollshop9,channel,AnimeCollShop,390,🌟 Добро пожаловать в наш аниме-мир! 🌟 🎉 Здесь мы делимся выгодными предложениями с нашего Авито: clck.ru/3JoPrN 🔥 Обсуждаем и делимся впечатлениями - https://t.me/animecollshop8  По всем вопросам @ACSmanager
urbanjunglebelarus,channel,Комнатные растения Беларусь,1276,Излишки частной коллекции комнатных растений + закупка Тайских растений. Вся коллекция в инстаграм - @urbanjunglebelarus
jauda_saudia,channel,Jauda,264,Jauda - комфортные путешествия в Саудовскую Аравию!  https://t.me/jauda_ksa - для связи с Нами!✍️
saudianewsru,channel,SAUDIA_NEWS,559,"Канал посвящён освещению для русскоязычных читателей современной внутриполитической, религиозной и культурной жизни Королевства Саудовская Аравия."
saudovskaya_araviya,group,🇸🇦 Саудовская Аравия чат,4763,Саудовская Аравия чат   • Чаты по 150+ странам МИРА: @tele_360chat • Анонсы новых групп: @slavianskiy_forum  - Реклама: @PR_3600 - Как снять БАН: @unlock_360 - Техподдержка / АДМИНЫ: @FAQ360  ПРАВИЛА ЧАТА + проверенные люди: telegra.ph/360-10-05
sushi_saudi,channel,Суши Саудия / Sushi Saudi,562,🍣 Суши и роллы в Медине  🚚 Доставка по Медине  Суши • Роллы • Сеты • Моти  📲Для заказа братьям : https://wa.me/+966541426439  📲Для заказа сестрам :https://wa.me/+966571178535
life_saudi,channel,LIFE SAUDI,180,Как посетить? Куда сходить? Где поесть? На что посмотреть?   🌴 Все особенности туризма в одном флаконе  Интересно больше о КСА? Все каналы: @saudi_chats  Всё о доходных инвестициях: @investannagroup
saudiarabiabusiness,group,"Бизнес чат Саудовская Аравия | Мероприятия, нетворкинг, общение и реклама в Саудовской Аравии | Медина, Мекка, Джидда, Эр-Рияд",2371,"🔥Самый большой бизнес чат Питера  ❗️Читайте правила или бан  ➡️Все наши бизнес чаты  @businesschats_top1  ➡️Владелец, гуру рекламы @medvedev_blog  😎Продвижение бизнеса, продюсирование, трафик тут: biznesraskrutka.ru"
infoaboutsaudiast,channel,Новости Саудовская Аравия,7013,"Агрегатор новостей СМИ и соцсети про Саудовскую Аравию и в целом про экономику Большого Ближнего Востока и Персидского залива.  Репост ❌ одобрение, собираем разные СМИ с разными мнениями.   Чат @domeoftherock1"
saudiet,channel,Saudi English Teachers,3687,Lifelong learning
saudiya_elon,channel,Saudiya E’lonlari,554,"Saudiyadagi oʻzbeklar uchun aralash eʼlonlar kanali.  ❗️Eʼlonlar uchun kanal maʼmuriyati masʼul emas, eʼlon muallifi javobgar hisoblanadi. ❗️   E’lon berish uchun quyidagi profilga batafsil ma’lumot yozing.   Admin: @Saudiya_elon_admin1"
saudia_new,channel,سعودية نيوز,33,أخبار الخليج لحظة بلحظة
saudiya_guruhlari,channel,@Saudiya — Guruhlari,306,Ko’proq Guruhlar  link 👉 t.me/addlist/FetYjDkuWFcwOWVi
saudiyabozori,group,Saudiya Bozori — E’lonlari,1301,Saudiya Arabistonidagi oldi-sotdi va boshqa turdagi savdolar guruhi!  Hamkorlik uchun: @Yoqub
kanalbeasiswatimurtengah,channel,Kanal Beasiswa Timur Tengah,10142,
madinahayoti7,channel,🌴Maдинага ошиклар🌴,2493,Мадина шахрига ошиклар🥰 Пайгамбаримиз  С.А.Вга ошиклар  ИншаАллох Хар куни Мадинага сайёхат киламиз🌴 Мадинани согинган калбларга малхам
madinfobiz,channel,Дерзкий Инфобиз,3260,"Создаю пространство для своих, где каждый чувствует себя на своем месте среди таких же близких как он ❤️❤️❤️  Собираю более 2000 участников на онлайн конференции и объединяю сильных людей."
jxdkkhgluflucljvuvilgg,group,መርጌታ ፈጠነ ከፍተኛ የባህል ህክምና 🍀☘️🌿,74009,
margatmagst,group,መምህር መንግስቱ የባህል መድኃኒት,48596,https://t.me/margatmagst
shehahmed123,group,ሸህ አህመድ የባህል ህክምና,46250,
groupetio2,group,መርጌታ ፈጠነ ከፍተኛ የባህል ህክምና 🍀☘️🌿🌴,53040,
