jobspharm,group,👩‍⚕️ Jobs Pharm 🩺,2075,Asalomu alykum  Kanalimizga XUSh KELIBSIZ❗️  Bizda e'lon berib tez va oson natijaga erishing   👩🏼‍💻Adminka: @elonadminka
natijarezultat,channel,TIENS МАХСУЛОТЛАРИ ВА НАТИЖАЛАРИ,777,🩺Sogʻligingizga befarq boʻlmang.  💊Sog'ligingiz o'z qo'lingizda!  Тяньши компаниясининг маҳсулотлари билан олий тоифали шифокорларимиз тавсиялари асосида сифатли даволанинг  📨Bogʻlanish uchun: @Shuhrat1381  📞Murojaat uchun: 90-967-03-18
vladivastok5,channel,Vladivostok Avto Bazar (MAHMUDOV),551,Biz Bilan Tez Va Osson Natijaga Erishasiz  Reklama Uchun : @Mahmudov_Husein27   #Vladivostok #Vladivastok #VladivostokRabota #Vladivostok_Rabota #Vladivostokish #Vladivostok_ish
natyoga,channel,Йога с Натали💚,375,Йога в центре Санкт-Петербурга и онлайн Йога как образ жизни. Запись здесь https://natyoga.rubitime.ru  Все вопросы ➡️ @yoginataly
filial_deadman,channel,Альтушка на вАйне,152,"Мысли, рассказы и черный юмор"
filialdubai,channel,Филиал - Дубай,99,"Развлекательно-познавательный канал о жизни и бизнесе в Дубае. Лайфхаки и факапы, никакого успешного успеха.  за консультациями обращаться по адресу: @denispilyov"
alessaxtrading,channel,Alessa XTrading 📈,1227,Telegram pessoal oficial :   👉 @aleronconii  Instagram pessoal oficial :   👉 https://instagram.com/aleronconi_trader  👉 Comunidade no whatsapp :  https://chat.whatsapp.com/Gu9YIlg3rx99vUNvT0vHZ7
btatrading,channel,BTA Trading | FX & Crypto,8261,Форекс и криптовалюты за гранью технического анализа.  https://linktr.ee/btatrading
cryptodrive_success,group,Cryptodrive - הצלחה שלך בשוק הקריפטו,1271,"@Alifshiz (0542162497) מספקת שירותי לימוד, אינה בעלת רישיון מכוח חוק הייעוץ ואינה עוסקת במתן שירותי ייעוץ השקעות כהגדרתם בחוק הסדרת העיסוק בייעוץ השקעות, שיווק השקעות וניהול תיקי השקעות, תשנ״ה – 1995 עיסוקים הפטורים מרישיון בהתאם לקבוע בחוק הייעוץ."
cyberzing,channel,CyberZingFx Signals Free,417,Forex Trading Price Action Signals generated by CyberZingFx Indicators👨🏽‍💻 BUY/SELL Order Signal📈Alerts 🎯90% Accurate 💰100% Free Important❗️- Always put Stop Loss for Every Order  https://www.mql5.com/en/users/afsalme/seller   Contact - @CyberZingFx
aztradescrypto,channel,AZTRADESCRYPTO (MARKET ANALYSIS),921,"EDUCATIONAL POSTS, NOT FINANCIAL ADVICE. TRADING CRYPTO IS INHERENTLY RISKY AND YOU HAVE THE POSSIBILITY OF LOSING MONEY  Market Commentary and Analysis"
strefatradingu_pl,channel,STREFA TRADINGU,252,Zapraszamy na naszego discorda: https://discord.gg/strefatradingu
aienigmakz,channel,__ENIGMA__KZ,553,ТРЕЙДЕР AI-АГЕНТЫ НОВОГО ПОКОЛЕНИЯ САЙТ: https://enigmakz.com
atzboteatrading,channel,ATZ EA TRADING,400,Chào mọi người! Có 2 hình thức dùng bot GCEA:  - C1: Thuê 50$ MQL5: https://www.mql5.com/en/signals/2332085 - C2: Social exness: https://social-trading.exness.com/strategy/227895066/a/jtkx1swyyf?sharer=trader - Chi tiết: https://linktr.ee/atz.academy
eatradingai,channel,EA Trading AI - GPT-5.2-Codex Analysis,425,eatrading.ai
zetradex,channel,Zetradex,103,Zetradex is a leading Forex broker that offers its clients a comprehensive trading experience.  Open Account zetradex.com  Group Channel https://t.me/zetradexgroup
tradinguzchat,group,Trading Chat,148,Founder: @WhaleUzb
alltradechat1313,group,ALL Trade Chat,310,Founder of The Company : Abdulaziz  SnR  -  SnD  Strategy  Har Kunlik Natijalar                  Asosiy kanal:  https://t.me/+TrMC7G2OWLdmMGQ6
art_du_trading,channel,ARTDUTRADING,206,"ICI des opportunités de trading 100% GRATUITES sur les actions, devises, indices et matière première, sans affiliation avec des brokers véreux."
alfaradioby,channel,Альфа Радио,166,"Радиостанция ""Альфа Радио"""
alchurazov_crypto,channel,Alchurazov crypto ∞,104,"Крипта человеческим языком.  – системный взгляд на рынок   – психология трейдинга   – мои наблюдения, опыт и жизненные выводы   – направления, где реально можно заработать    Цель канала — дать тебе ясную голову и стратегию.   А не гонять за эмоциями."
metaratingsby,channel,Metaratings.by,1678,"💜Главное о белорусском спорте: эксклюзивно, объемно и с душой👉  metaratings.by  ММА – @metamma Киберспорт – @metacyber Конкурсы – @metacontest 🇷🇺 – @metaratings 🇰🇿 – @metaratingskz  Мы в других соцсетях: vk.com/metaratingsby"
bologovsky69,channel,Бологое • Новости,1448,Главный канал г.Бологое и района. Подписывайся и пригласи друзей - https://t.me/Bologovsky69 По всем вопросам - @bo1ogoe
flossyshoes_khv_kms,channel,Flossyshoes_khv_kms,935,Летняя испанская обувь. Хабаровский край
belioangelika,channel,"🤍 AНДЕЛИСА - мир женского белья, домашней одежды, купальников 🤍",617,"Белье с правильной посадкой от ведущих производителей России и Европы! ​​Размеры: от 65A до 100L.  Сайт: angelicaonline.ru   Оформить заказ:  Менеджер @Belioangelika1 https://WA.me/79774982328  Люберцы, Октябрьский проспект 112, ТРЦ ""Выходной"", 2 этаж"
baila_bonito,channel,Baila Bonito dance club,72,Salsa & Bachata club (Recklinghausen) Наш чат для обсуждения:  https://t.me/baila_boniro_chat
molodezhbykhova,channel,|БРСМ | Быховщины #molodezhbykhova,197,"Официальный канал Быховского районного комитета Общественного Объединения ""Белорусский Республиканский союз молодежи """
fcaresa,channel,ФК «Арэса»,139,Футбольный клуб города Любани⚽️
blr_lichess_league,channel,Белорусская Народная Лига,128,
coolshoesby,channel,www.coolshoes.by,30,"Оригинальные кроссовки, обувь и аксессуары в Беларуси"
ccbo23,channel,Chapters and Chats Book club,1183,"📖 Are you open to reading? That’s all it takes to join us! 💙 Dive into amazing books, share your thoughts, and connect with fellow readers. ✨ Have feedback or questions? Chat with our private bot 🤖💌 👉https://t.me/chapters_and_chatBOT"
stetchingloystudio,channel,🧘🏻‍♀️LOY | Студия растяжки и фитнеса,694,Фитнес | Нижний Новгород
mrckazan,channel,MRC Kazan,630,MRC Kazan это любительский социально беговой клуб Mikkeller Running Club. Бегаем каждую первую и третью субботу месяца с 1 мая 2016 года от бара Фомин в Казани.  на пробежках Фото и видео: instagram.com/mrckazan
a22fest,channel,22фест,200,"22фест — это 5-дневный маршрут по молодежным пространствам Адмиралтейского района, где ты можешь попробовать разные направления для хобби и выбрать то, что откликается сердцу ❤️"
eventsopportunities,channel,МЦ ПОДІЇ/МОЖЛИВОСТІ,137,"Вітаємо! У цьому каналі ви знайдете анонси заходів Молодіжного центру, а також фото з подій і яскраві моменти нашого життя. Слідкуйте, щоб нічого не пропустити ✨"
finlitnetwork,group,Finlit Network,321,Sahnaga chiqmoqchimisiz? 🎤 Formsni to‘ldiring 👇 👉 https://forms.gle/zy1zMEuXm7neuagv5
hotgirlsrun,channel,HOT GIRLS CLUB🌶️,329,клуб самых классных девочек🫵👑
nightwayslatt,channel,nightway или лилплаг,307,booking/лс: @slattgang228
kilokalorii100,channel,100 калорий,153,"Ешь больше для похудения 😉 Тренируйся, чтобы вкусно есть 😅 Как? Рассказываю, читайте ❤️"
hakesheer,channel,Бродяги Хейкшира,124,Творческий дуэт ВК: https://vk.com/hakesheer Будем делиться здесь всяким ✨
mrcvoronezh,channel,Mikkeller Running Club Voronezh,59,"Это клуб любителей бега и крафтового пива. Тут публикуются анонсы пробежек, новости и всё другое интересное от Mikkeller Running Club Voronezh.  Клубные забеги проходят каждую первую субботу месяца в 16:00 из бара «13 Rules»."
shahrisabztmmtb,channel,Shahrisabz tuman maktabgacha va maktab ta'limi,422,Shahrisabz tuman maktabgacha va maktab ta'limi bo'limining rasmiy telegram kanali.  Kanalga maqolangizni joylashtirish uchun @abdisalom ga murojaat qiling  www.facebook.com/shahrisabztxtb
shahrisabz_baken,group,🕊️Shahrisabz bakin kabutarlari 🪽,370,🥇Шахрисабз  каптарлари Bu guruhda faqat bakkin kaptarlar tashlashingiz mumkin🕊️
yoshlaragentligishahrisabz,channel,SHAHRISABZ TUMANI YOSHLARI,1150,O‘zbekiston Respublikasi Yoshlar ishlari agentligi Qashqadaryo viloyat Shahrisabz tuman bo'limining rasmiy Telegram sahifasi
yandexpronews,channel,Яндекс Про для партнёров,1262,Важные новости о работе партнёров Яндекс Про в Беларуси
tavridabrokers,channel,Tavrida Brokers,2337,Умный помощник для партнёров — @TAVRIDABROKERS_BOT 💬  ГК «Таврида Девелопмент» — https://tavrida-development.ru
svoyvalfe_yugovostok,channel,Свой в Альфе | Юго-Восток,1722,Региональный канал для Партнёров Региона №18: ✅ Республика Бурятия ✅ Иркутская область ✅ Забайкальский край
jettonpromo,channel,JetTon Partners Promo,1173,Свежие промо для партнёров JetTon Новости @jettonpartnersinfo Саппорт и заказ выплат: @JetTonPartners
sksarmat_agent,channel,СК «Сармат» | Для партнёров,577,🔶 Сообщество для партнёров СК «Сармат»  • ипотечные расчёты каждую неделю • актуальные новости из мира недвижимости • полезные материалы и обзоры ЖК «Сармат» для ваших рассылок
dkmkefir,channel,ֺ ֺ «𝒫 𝘰𝘳𝘵 𝒦e͟͟f͟͟i͟͟r͟͟a͟͟» ִ ׁ,344,🌻.    ⸼𝂅ׄ    для фанатов 𝒦ефира. . . #𝔎𝟥𝙛 𐑻𝂅ׄ  ִ
kriliakrasnodar,group,Чат Бизнес Афиша community Краснодар,1070,"✅ Обмен опытом ✅ Поиск партнёров, подрядчиков ✅ Знакомства ✅ Вопросы и реклама  @kriliakrdbiz  ➡️ https://bizneskriliakrd.taplink.ws/"
shikbusiness,channel,Shik Store,637,"Канал для партнёров брендов SHIKstudio, SHIK PRO BROW BAR, Estepic, Natalya Shik 🖤"
bogatei88,channel,КАК ПРИВЛЕКАТЬ ПАРТНЁРОВ через ВК и не только..,326,Покажу простой и реально работающий способ привлечения активных партнёров через холодные контакты.   👉 ПИШИ @Galyna7777
onevents,channel,🗓 OnEvents,388,https://onevents.ru/ - Календарь жизни сообщества 1С
yacherdak,channel,чердак с историями | книги 18+,52056,18+  ВК:  https://vk.com/youngadultfiction MAX: https://max.ru/youngadultfiction  Правила: https://t.me/yacherdak/93  Для связи писать в сообщения канала.  РКН: https://knd.gov.ru/license?id=673c522931a9292acd1b90dc&registryType=bloggersPermission
psihologiua_dushi,channel,ПСИХОЛОГИЯ ДУШИ,11462,"Регистрация в РКН https://gosuslugi.ru/snet/69b0007a38f5082bb52320e8  Владелец @baby_fidge Паблик с притчами, историями, рассказами, которые греют душу)))❤️❤️❤️  #JKEPT"
storycaffee,channel,[𝕊𝕥𝕠𝕣𝕪ℂ𝕒𝕗𝕗𝕖𝕖],1540,ارسالیاتون 👇 @Shm_C64
mshpairingscf,channel,набор в адм mineshield pairings confessions,1699,
partnervipclub,group,Gambling Чат Аффилейтов - partnervipclub.com,414,"Партнерская программа от прямого рекламодателя продукта VIPCLUB.CASINO WWW.PARTNERVIPCLUB.COM - до 60% от NGR Даем прилки вебам по запросу - https://t.me/vipclubtraf  ГЕО и локализация продукта: ЕВРОПА, АЗИЯ  - За исключением стран с местным регулятором"
gdeslontp,group,Где Слон? - вопросы по работе,464,"Чат поддержки для вебмастеров и рекламодателей партнёрской сети ""Где Слон?""🤘  Официальный ТГ канал: 👇 https://t.me/gdeslon Свежие новости, дайджесты, полезное о заработке в CPA. Подписывайтесь!"
gdeslon,channel,"Где Слон? - наши новости, акции и конкурсы",355,"🤘Официальный канал партнёрской сети ""Где Слон?""  💵 Здесь всё о заработке в CPA.   ⏰ Быстрая регистрация: https://bit.ly/3uBBCtO  💡 Есть вопросы и предложения? Пишите в наш чат: https://t.me/gdeslontp"
doxoddlyavsex,channel,💰 Доход через соцсети🤩,287,"Здесь ты узнаешь, как:   -  настроить заработок без рисков  от 300 $ уже в первый месяц в партнёрской программе -  стать магнитом для кандидатов   Подробности здесь  https://biznes-pod-klych.com/?s=2&u=polosik19  Вопросы в личные 👉  @natapoloskova"
heartspartners,channel,Hearts Partners,94,"❤️ Hearts Partners is a fast-growing iGaming affiliate program:  📌 Exclusive brand Rockstar 📌 15 GEOs 📌 RS up to 45%, CPA up to €500  ♦️ Start working - https://hearts.partners/"
sakhishopsadovod,channel,𝐋𝐀𝐃𝐘--𝐒𝐓𝐘𝐋𝐄.Женский Мужские Одежда Садовод,1987,"Поставщик Москва Рынок Садовод Минимальный заказ от 1 штук! Отправка через Почту России, СДЭК, Автобус  Для заказа  пишите           Telegram  @sakhishop2003 Номер для связи  +79992977698 Ватсап для заказа  +79992977698"
mensdiaries,channel,Сергей Бедрига|Мужские дневники,1075,"Авторский мужской блог. Размышляю об отношениях, поиске себя и своего призвания, а также способах прожить осмысленную и счастливую жизнь."
perehodnikmanboobs,channel,переходник мужские сиси кф,989,
altrobagno_italy,channel,ALTROBAGNO,120,Сантехника бренда ALTROBAGNO
aramarnoavto,channel,АВТОПОРТАЛ Арамарно,78,Есть машина? Подписывайся! Поможем сэкономить деньги на ремонт и автоуслуги!
jorno_it,channel,Jorno Group | Мебель для ванных комнат,380,✔️ 26 лет производим мебель для вас  ✔️ 5000 м² производственных площадей  ✔️ 500+ профессионалов в команде ✔️ 5+ млн. довольных клиентов в 70+ регионах России и СНГ  Наши сайты:    https://www.jorno.it/                             https://www.raval.ru/
il_tuo_atelier,channel,IL TUO ATELIER,198,Мягкая мебель премиум класса ita-official.ru
alfannovell,channel,Алый Фан,86,Фан-канал по новеллам Senses 💛 • «Алая Линия»  • «Сердце Дракона» • «Цена Репутации» • «Аристократка в Алом» Начало: 23.12.25
f164l,channel,16 1 ᯓ,185,𝗹𝗮𝗻𝗱𝗼 𝘄𝗲 𝗰𝗮𝗻 𝗯𝗲 𝘄𝗼𝗿𝗹𝗱 𝗰𝗵𝗮𝗺𝗽𝗶𝗼𝗻 𝗶 𝘀𝗮𝗶𝗱! - Blue t.me/HidenChat_Bot?start=122296749 - armita  t.me/HidenChat_Bot?start=6082163149 16 1
offside_mag,channel,Fanzine 🇵🇸,135,Интернациональный фан-вестник. Рассматриваем футбол как народную культуру и форму сопротивления. Рассказываем о народном спорте.
alephstone,channel,Aleph,40,
vasudumaet,channel,Вася думает,116,"Личная страница Симакиной-Соловьевой Василисы …винтажно,экуменистически,рецензентно…"
thoughtsaboutmeaning1,channel,Мысли о смысле,270,
salomonzwhale,channel,Salomon’s Whale,1004,"«Успешные трейдеры думают в вероятностях. Они не гадают, что произойдет, они готовы к любому сценарию.»  🗣Личный путь развития, который приводит к результату.   💰Торговый Чат: https://t.me/+-j2j8iJPteg4Njdi"
mamba_pr,channel,Мамба нейропиара,851,"Хотите узнать, что нейросети думают на темы этого вашего пиара? Лучшие кейсы, реальные исследования и достоверные факты прямо из нейромозга. Бустим PR и коммуникации на максималках!🔥 Берем самые горячие темы, превращаем в посты — и прямиком в твою ленту"
thoughtsaroundthesun,channel,Thoughts Around The Sun,136,"Extended universe of the music project Laps Around The Sun. Thoughts, conversations, articles and internet jewels curated / created by @lapsaroundthesun."
suayro,channel,ее звали «суайро»,371,"они думают, что я веду канал, а я изливаю душу.. для связи: https://t.me/suayyro"
chernofftrade,channel,ChernoFF,495,"🧠 Не публичный трейдер Ончейн трейдинг · ликвидность   🏦Знаю, как думают фонды и Маркет-Мейкер 🚫 Технический анализ нужен толпе, чтобы ошибаться синхронно. 📉 Если в 2026 ты торгуешь по сетапам — ты ликвидность."
pokadrugiedumayut,channel,Пока другие думают | бизнес стратегии с Дарьей Геращенко,172,"Пока другие думают – ты уже действуешь.  Канал о стратегическом мышлении, масштабировании бизнеса и системном росте.  Разбираем кейсы, анализируем тренды и строим масштабные стратегии.  https://t.me/Gerashdasha  https://gerashchenkodaria.com"
alphakombatcommunity,group,Alkom BSC - SOL,123,Website: https://alphakombat.com/ Twitter: https://twitter.com/Alphakombatgame Announcement channel: https://t.me/alphakombat  Turkish TG: https://t.me/alphakombatturkey Chinese TG: https://t.me/alphakombatchineseChat LET'S PLAY ▶️
alpinbetchat,group,Alpinbet | Pinnacle | Боты,2705,"⚽️Сайт: https://alpinbet.com 🤖Конструктор ботов: футбол, хоккей баскетбол 💵БК: Pinnalce, Fonbet 📊Ретроанализ 💰Автоставка   💬Новости проекта: @alpinbetcom 💬Чат:https://t.me/+hTJLAPjsPnUzNThi 🚫За мат и рекламу бан ☎️Связь: @alexalpin (9:00-19:00)"
alphakombat,channel,Alkom channel,1014,
bumkombat_chat,group,Bum Kombat Chat,781,
alphakombatturkey,group,ALPHAKOMBAT Turkey,51,Website: https://alphakombat.com/ Announcement channel: https://t.me/alphakombat
crytpomasterclass,channel,Crypto Alpha Community Channel 🚀🌕,263,"This is community for crypto enthusiasts, where you get latest info and trends as regard the Crypto Space...  Follow us on ⤵️:  https://linktr.ee/cryptoalpharesources  WAGMI"
chatbyalpha,group,Alpha Chat,103,Торгуем на рынке с широким плечом!
alphahookahchat,group,Alpha Hookah Chat,276,
alhayatchat,group,AL - Hayat - Мусульманский форум,19,"Напишите меню в каждом разделе форума, удобный доступ к информации."
alphateka,group,AlphaTeka 🇷🇺,159,Вы на канале технической поддержки компании АЛЬФАГЕО -генерального дистрибьютера оборудования AlphaGEO  В нашей группе Вы найдете обучающие материалы по работе с оборудованием AlphaGEO и ПО SurPro6.0  Телефон: 8(800)600-35-44 Официальный сайт: alphageo.ru
alchemyofficial,channel,Alchemy,67,Welcome to the Alchemy DAO channel!
aquilacheats,channel,AquilaCheats - официальный канал,78,Официальный канал AquilaCheats. Официальный сайт:  https://aquilacheats.ru Наш чат: https://t.me/aquilachat
alphakokboru,channel,alpha ķokbørų | қазақша фанфик топтамалары,31,
calljimkramer,channel,JIM KR🅰️MER CALLS ☎️,8,Personal trades  Contact: @inverseJim  Twitter: https://twitter.com/inversejim?s=21&t=BFL5u0WyaFfBOYOzE69d4Q  Chat: https://t.me/jimkramertraphouse1000x
familio_arkhangelsk,group,Familio | Архангельская область. Генеалогия,1477,Вся актуальная информация по данному чату в посте: https://t.me/familio_arkhangelsk/4968  Чат является частью проекта Familio @familio_chat
awakesisters_saintp,channel,AWAKE SISTERS // Санкт-Петербург,272,❤️Сестринство Женское комьюнити Awake Sisters в Петербурге от Анны Аяны Лесной @ayanalesnaya
aa_izosimovaaa_fan,channel,мама Геля,228,Pollinaria Канал по прекрасной Ангелин Юрьне 🤍 Начало: 06.04.25г  ТТ: a_izosimovaa
arhvledebilgaming,channel,arhvдебили💤м,770,☺️  handmade btw —> ...................... #i123
o29rf,channel,Объясняем.Архангельская область,770,"Объясняем.рф – полноценная, оперативная и достоверная информация.  Сайт «Объясняем.рф» запущен Правительством России для информирования граждан по волнующим и самым актуальным вопросам.  Чат-бот с ответами на вопросы: https://fstrk.cc/qyTMhPh"
zabizness,channel,Мой бизнес | Архангельская область,881,"⚡️Новости для бизнеса о бизнесе.   ❗️Ежедневно Агентство регионального развития, Центр услуг «Мой бизнес» будет размещать тут актуальные новости, которые помогут вам сохранить и развить ваше дело!"
arho29,channel,Архангельская область нашими глазами,335,"Архангельская область ❤️ Для Ваших фото / видео предложений есть бот, напишите ему: @ArkhangelskayaObl_bot"
pogost35,channel,Дом в Ошевенском Погосте,413,"Дом 1900 года постройки, и его новая жизнь.  Владелица — @mettlachtiles 📍 Архангельская область, Ошевенский Погост, дом 35"
